"company_name","business_state","sic_code","phone_number","website","business_categories","business_city","business_country","business_zip_code","closed_on","opening_hours","closing_hours","latitude","longitude","location_type","year_established","avg_opening_hour","avg_closing_hour","business_street_name","description","services","links","estimated_annual_revenue","num_employees","review_count","reviews","owner","manta_link","url","company_id"
"Point 2 Point Global Security, Inc","Maryland","7381","(41***638***88","http://www.p2pgsi.net","[""Business Services"",""Detective, Guard, and Armored Car Services"",""Security guard service""]","Phoenix","United States","21131","{""friday"":false,""monday"":false,""saturday"":false,""sunday"":false,""wednesday"":false}","[null,null,null,null,null,null,null]","[null,null,null,null,null,null,null]",39.5183,-76.56799,"HQ",2004,,,"3313 Paper Mill Rd. Suite 204","Point 2 Point provides physical security nationwide including: unarmed and armed guards and off duty police to the commerical and government sectors.
Point 2 Point Global Security, Inc. was established in 2004 in Chino Hills, California, to provide off duty police officers for commercial clients on a nationwide basis. With a commitment to quality and superior customer service, P2P quickly set itself apart from the competition.

Over the past 7 years, P2P has continued its commitment to quality and superior customer service as our rapid growth has supported. Today, we continue to offer off duty police officer services, but have grown to offer uniformed unarmed and armed guards, patrol services, loss prevention, security assessments, executive protection - now licensed in over 20 states nationwide - providing service to Fortune 500 commercial clients and the Federal Government.

""P2P is committed to providing our service the right way","[""Uniformed Unarmed Guards"",""Uniformed Armed Guards"",""Off Duty Police"",""disaster rescue operations"",""Executive Protection""]",,,"100 to 249",,,,"https://www.manta.com/c/mmd6dqd/point-2-point-global-security-inc","https://www.manta.com/c/mmd6dqd/point-2-point-global-security-inc","mmd6dqd"
"VIDA BEM LLC","California","7999","661***319***","https://www.vidabem.us","[""Travel & Leisure"",""Amusement Services"",""Field""]","Bakersfield","United States","93308",,,,35.4195087,-119.038052,"unknown",2015,,,"1400 Norris Road null","Categorized under Computer Leasing and Renting. Current estimates show this company has an annual revenue of 55057 and employs a staff of approximately 2.",,,"55057","2",,,"Jos***oza***","https://www.manta.com/c/mkhxnf1/vida-bem-llc","https://www.manta.com/c/mkhxnf1/vida-bem-llc","mkhxnf1"
"Druid Park","Maryland","7999","410***782***","http://bcrp.baltimorecity.gov/parks/druid-hill","[""Travel & Leisure"",""Amusement Services"",""Playgrounds""]","Baltimore","United States","21211",,,,39.3312365,-76.6502217,"unknown",2012,,,"2165 Druid Park Drive null","Categorized under Office Buildings and Parks. Our records show it was established in 2012 and incorporated in Maryland. Current estimates show this company has an annual revenue of unknown and employs a staff of approximately 5 to 9.",,,,"5 to 9",,,,"https://www.manta.com/c/mtrskpb/druid-park","https://www.manta.com/c/mtrskpb/druid-park","mtrskpb"
"Piedmont Sports Association","Oklahoma","7997","405***481***","https://start.cortera.com/.../l1n3ntq8r/piedmont-sports-association","[""Travel & Leisure"",""Membership Sports and Recreation Clubs"",""Recreation Centers""]","Piedmont","United States","73078",,,,35.6524333874478,-97.7423227997798,"unknown",2001,,,"314 Edmond Road NW null","Categorized under Recreation Centers and Rec Centers. Our records show it was established in 2001 and incorporated in Oklahoma. Current estimates show this company has an annual revenue of 68862 and employs a staff of approximately 2.",,,"68862","2",,,,"https://www.manta.com/c/mm2llsy/piedmont-sports-association","https://www.manta.com/c/mm2llsy/piedmont-sports-association","mm2llsy"
"Tap Plumbing","South Carolina","1711","843***690***","null","[""Consumer Products and Services"",""Plumbing, Heating, and Air-Conditioning"",""Heating Contractors""]","Hardeeville","United States","29927",,,,32.2635,-81.0669,"Unknown",,,,"Po Box 42","Categorized under Heating Contractors. Current estimates show this company has an annual revenue of less than $500,000 and employs a staff of approximately 1 to 4.",,,,"1 to 4",,,"Tim***y P***ett***","https://www.manta.com/c/mb8pn8q/tap-plumbing","https://www.manta.com/c/mb8pn8q/tap-plumbing","mb8pn8q"
"Tips Neighborhood Auto Insurance","Arkansas","6411","479***200***","null","[""Insurance"",""Insurance Agents, Brokers, and Service"",""Insurance Consultants and Advisors""]","Fort Smith","United States","72901",,,,35.3865182,-94.4184331,"unknown",2008,,,"2800 Grand Avenue null","Categorized under Insurance Companies. Our records show it was established in 2008 and incorporated in Arkansas. Current estimates show this company has an annual revenue of less than $500,000 and employs a staff of approximately 1 to 4.",,,,"1 to 4",,,"Gra*** Ra***","https://www.manta.com/c/mtmgcvn/tips-neighborhood-auto-insurance","https://www.manta.com/c/mtmgcvn/tips-neighborhood-auto-insurance","mtmgcvn"
"Sixth Street Church Of God In Christ","Louisiana","8661","318***664***","http://www.churchofgod.cc","[""Non-Profit Organizations"",""Religious Organizations"",""Churches""]","Ferriday","United States","71334",,,,31.6256410074656,-91.5576138485542,"unknown",1994,,,"512 6th Street null","Categorized under Miscellaneous Denomination Church. Our records show it was established in 1994 and incorporated in Louisiana. Current estimates show this company has an annual revenue of 60358 and employs a staff of approximately 1.",,,"60358","1",,,"Wil*** J ***is","https://www.manta.com/c/mm42vf8/sixth-street-church-of-god-in-christ","https://www.manta.com/c/mm42vf8/sixth-street-church-of-god-in-christ","mm42vf8"
"Richardson's Truck Diesel & At","Oklahoma","7538","918***322***","null","[""Automotive Services"",""General Automotive Repair Shops"",""Car Repair and Services""]","Muskogee","United States","74401",,,,35.74743,-95.40473,"Unknown",,,,"3637 State Highway 51b","Categorized under Car Repair and Services. Current estimates show this company has an annual revenue of less than $500,000 and employs a staff of approximately 1 to 4.",,,,"1 to 4",,,,"https://www.manta.com/c/mbsmt3p/richardson-s-truck-diesel-at","https://www.manta.com/c/mbsmt3p/richardson-s-truck-diesel-at","mbsmt3p"
"Amg Automotive Inc","Delaware","7539","302***103***","http://facebook.com/AmgAuto/","[""Automotive Services"",""Automotive Repair Shops, NEC"",""Automotive Repair Shops, Nec""]","Wilmington","United States","19804",,,,39.713816,-75.600556,"Single Location",2008,,,"1504 East Ayre Street","Categorized under Automotive Repair Shops, Nec. Our records show it was established in 2008 and incorporated in Delaware. Current estimates show this company has an annual revenue of 110000 and employs a staff of approximately 1.",,"{""facebook"":""http://facebook.com/AmgAuto/""}","110000","1",,,"R E***mas***i J***","https://www.manta.com/c/mry9p03/amg-automotive-inc","https://www.manta.com/c/mry9p03/amg-automotive-inc","mry9p03"
"Lenders Asset Management Corporation","Colorado","6531","303***635***","null","[""Real Estate"",""Real Estate Agents and Managers"",""Real Estate Management""]","Littleton","United States","80128",,,,39.5918,-105.0832,"Unknown",1991,,,"6588 West Ottawa Avenue","Categorized under Real Estate Management. Our records show it was established in 1991 and incorporated in Colorado. Current estimates show this company has an annual revenue of $500,000 to $1 million and employs a staff of approximately 1 to 4.",,,,"1 to 4",,,"Fra***Haw***","https://www.manta.com/c/mm02m4r/lenders-asset-management-corporation","https://www.manta.com/c/mm02m4r/lenders-asset-management-corporation","mm02m4r"
"1280 Ute LLC","Colorado","6512","970***116***","http://www.aiare.info","[""Real Estate"",""Operators of Nonresidential Buildings"",""Office Buildings and Parks""]","Aspen","United States","81611",,,,39.180964,-106.811086,"Single Location",2007,,,"1280 South Ute Avenue # 16","Categorized under Office Buildings and Parks. Our records show it was established in 2007 and incorporated in CO. Current estimates show this company has an annual revenue of 195762 and employs a staff of approximately 3.",,,"195762","3",,,"Eri***ars***","https://www.manta.com/c/mmy8tlt/1280-ute-llc","https://www.manta.com/c/mmy8tlt/1280-ute-llc","mmy8tlt"
"Cody Lensing Attorney","Montana","8111","406***422***","null","[""Legal"",""Legal Services"",""Lawyers and Attorneys""]","Glendive","United States","59330",,,,47.103618,-104.714284,"Single Location",2014,,,"100 South Merrill Avenue","Categorized under Lawyers and Attorneys. Current estimates show this company has an annual revenue of 57873 and employs a staff of approximately 2.",,,"57873","2",,,"Cod***ens***","https://www.manta.com/c/mbdy832/cody-lensing-attorney","https://www.manta.com/c/mbdy832/cody-lensing-attorney","mbdy832"
"Gainwell Mechanical","North Carolina","1711","919***644***","null","[""Consumer Products and Services"",""Plumbing, Heating, and Air-Conditioning"",""Mechanical Contractors""]","Clayton","United States","27520",,,,35.6348,-78.451,"Unknown",2011,,,"8368 Us 70 Bus Highway West","Categorized under Mechanical Contractors. Our records show it was established in 2011 and incorporated in North Carolina. Current estimates show this company has an annual revenue of $500,000 to $1 million and employs a staff of approximately 1 to 4.",,,,"1 to 4",,,,"https://www.manta.com/c/mrydd3p/gainwell-mechanical","https://www.manta.com/c/mrydd3p/gainwell-mechanical","mrydd3p"
"Savarese John","Massachusetts","9999","781***910***","null","[""Nonclassifiable establishments"",""Nonclassifiable establishments"",""Nonclassified Establishments""]","Waltham","United States","02453",,,,42.3626126,-71.2334781,"Unknown",,,,"49 Fuller Street","Categorized under Nonclassified Establishments. Current estimates show this company has an annual revenue of unknown and employs a staff of approximately unknown.",,,,"UNKNOWN",,,"Joh***ava***e","https://www.manta.com/c/mb87lq9/savarese-john","https://www.manta.com/c/mb87lq9/savarese-john","mb87lq9"
"Sarsfields","Massachusetts","5812","617***231***","null","[""Restaurants and Bars"",""Restaurants"",""Restaurants""]","Quincy","United States","02169",,,,42.2466106,-71.0007599,"unknown",2007,,,"1464 Hancock Street null","Categorized under Restaurants. Our records show it was established in 2007 and incorporated in Massachusetts. ",,,,,,,"Dec*** Ke***","https://www.manta.com/c/mm094d4/sarsfields","https://www.manta.com/c/mm094d4/sarsfields","mm094d4"
"Caw Security Services","California","6211","818***343***","null","[""Financial"",""Security Brokers, Dealers, and Flotation Companies"",""Security Dealers""]","North Hollywood","United States","91606",,,,34.1091408,-118.3699804,"unknown",1996,,,"6331 Laurel Canyon Boulevard null","Categorized under Security Guard and Patrol Services. Our records show it was established in 1996 and incorporated in California. Current estimates show this company has an annual revenue of less than $500,000 and employs a staff of approximately 1 to 4.",,,,"1 to 4",,,"C W***ot","https://www.manta.com/c/mm231zd/caw-security-services","https://www.manta.com/c/mm231zd/caw-security-services","mm231zd"
"Diamond Black Exteriors","California","3211","818***999***","http://www.diamondblackexteriors.com","[""Chemical Materials"",""Flat Glass"",""Window Glass, Clear and Colored""]","North Hollywood","United States","91605",,,,34.2057,-118.4001,"Single Location",2011,,,"7445 Laurel Canyon Boulevard C","Categorized under Window Glass, Clear and Colored. Our records show it was established in 2011 and incorporated in California. Current estimates show this company has an annual revenue of 180000 and employs a staff of approximately 2.",,,"180000","2",,,,"https://www.manta.com/c/mby2x59/diamond-black-exteriors","https://www.manta.com/c/mby2x59/diamond-black-exteriors","mby2x59"
"Judicial Options","California","2899","951***811***","http://www.judicialoptions.com","[""Chemical Materials"",""Chemicals and Chemical Preparations, NEC"",""Drug Testing Kits, Blood and Urine""]","Hemet","United States","92545",,,,33.7513489,-116.9931831,"Single Location",2010,,,"305 Calle Nogales","Categorized under Drug Testing Kits, Blood and Urine. Our records show it was established in 2010 and incorporated in CA. Current estimates show this company has an annual revenue of 166042 and employs a staff of approximately 2.",,,"166042","2",,,"Bah***E W***on","https://www.manta.com/c/mb0y1c3/judicial-options","https://www.manta.com/c/mb0y1c3/judicial-options","mb0y1c3"
"Joseph Dupard Real Estate","Louisiana","6512","225***616***","http://www.dupardsells.com","[""Real Estate"",""Operators of Nonresidential Buildings"",""Property Operation, Retail Establishment""]","Baton Rouge","United States","70809",,,,30.389351,-91.0925263,"unknown",2010,,,"5025 Bluebonnet Boulevard null","Categorized under Real Estate Buyers Representatives. Our records show it was established in 2010 and incorporated in Louisiana. Current estimates show this company has an annual revenue of 110000 and employs a staff of approximately 2.",,,"110000","2",,,"Jos*** Du***d","https://www.manta.com/c/mrsyt6w/joseph-dupard-real-estate","https://www.manta.com/c/mrsyt6w/joseph-dupard-real-estate","mrsyt6w"
"New York Advance Electric System","New York","1731","347***148***","http://ushomeservices.us/electrician",,"New York","United States","10011","{""friday"":false,""monday"":false,""saturday"":false,""sunday"":false,""wednesday"":false}","[""12:00 AM"",""12:00 AM"",""12:00 AM"",""12:00 AM"",""12:00 AM"",""12:00 AM"",""12:00 AM""]","[""12:00 AM"",""12:00 AM"",""12:00 AM"",""12:00 AM"",""12:00 AM"",""12:00 AM"",""12:00 AM""]",40.737471,-73.99765699999999,"unknown",,"12:00 AM","12:00 AM","110 W 14th St Fl 2","Our Technicians are more than capable of handling your Electrical problems, Our Electricians have gained a lot of experience.
We Offer Electricians, Electrical Contractor, Commercial Electrician, Electrical Services, Residential Electrician, Electrical Maintenance Services, Electrical Installation Services, Residential Electrical Wiring Services, Any Electric Upgrade or Maintenance All services related Electricity. Call us any time on  3475181481","[""Electricians , Electric Contractors"",""Controls, Control Systems & Regulators , Electric Equipment Repair & Service""]",,,,,,"sho***es ***ali***","https://www.manta.com/c/mk7df5m/new-york-advance-electric-system","https://www.manta.com/c/mk7df5m/new-york-advance-electric-system","mk7df5m"
"Ashwood Home","Minnesota","1521","320***729***","null","[""Construction"",""General Contractors-Single-Family Houses"",""Home Improvements""]","Alexandria","United States","56308",,,,45.8963955,-95.3618786,"unknown",1994,,,"1105 Glendale Avenue null","Categorized under Rooming and Boarding Houses. Our records show it was established in 1994 and incorporated in Minnesota. Current estimates show this company has an annual revenue of 63720 and employs a staff of approximately 2.",,,"63720","2",,,"Dia***Ste***","https://www.manta.com/c/mm0gjvj/ashwood-home","https://www.manta.com/c/mm0gjvj/ashwood-home","mm0gjvj"
"Wesselhoeft Inc","Alabama","3441","205***221***","http://Bwheads.com","[""Fabrication"",""Fabricated Structural Metal"",""Steel-Structural Manufacturers""]","Moundville","United States","35474",,,,32.9108,-87.5935,"Unknown",,,,"12989 Cracker Road","Categorized under Steel-Structural Manufacturers. Current estimates show this company has an annual revenue of $2.5 to 5 million and employs a staff of approximately 10 to 19.",,,,"10 to 19",,,"Ann***mal***","https://www.manta.com/c/mth6ndk/wesselhoeft-inc","https://www.manta.com/c/mth6ndk/wesselhoeft-inc","mth6ndk"
"Wright's Grading Services Inc","Georgia","0781","706***916***","null","[""Agriculture"",""Landscape Counseling and Planning"",""Landscape Designers""]","Rome","United States","30161",,,,34.276859,-85.165757,"Single Location",1979,,,"31 Riverside Indus Park North","Categorized under Landscape Designers. Our records show it was established in 1979 and incorporated in GA. Current estimates show this company has an annual revenue of 290000 and employs a staff of approximately 4.",,,"290000","4",,,"Fra***Wri***","https://www.manta.com/c/mmj1ypl/wright-s-grading-services-inc","https://www.manta.com/c/mmj1ypl/wright-s-grading-services-inc","mmj1ypl"
"Aguilar Welding","Texas","7692","******","null","[""Consumer Services"",""Welding Repair"",""Welding""]","Odessa","United States","79763",,,,31.8616424,-102.4059819,"Single Location",2007,,,"2648 Santa Rosa Avenue","Categorized under Welding. Our records show it was established in 2007 and incorporated in Texas. Current estimates show this company has an annual revenue of 79000 and employs a staff of approximately 1.",,,"79000","1",,,"Pat***ia ***gui******","https://www.manta.com/c/mmyt9l5/aguilar-welding","https://www.manta.com/c/mmyt9l5/aguilar-welding","mmyt9l5"
"Dehydration LLC","North Carolina","2034","252***820***","null","[""Food"",""Dried and Dehydrated Fruits, Vegetables, and Soup Mixes"",""Dehydrating Services""]","Snow Hill","United States","28580",,,,35.428295,-77.663784,"Single Location",2015,,,"963 Highway 258 South","Categorized under Dehydrating Services. Current estimates show this company has an annual revenue of 128155 and employs a staff of approximately 2.",,,"128155","2",,,,"https://www.manta.com/c/mkk100v/dehydration-llc","https://www.manta.com/c/mkk100v/dehydration-llc","mkk100v"
"Fantasy Pet Products","Michigan","5999","248***067***","http://www.fantasypetproducts.com","[""Shopping"",""Miscellaneous Retail Stores, NEC"",""Pet Supplies""]","Troy","United States","48083",,,,42.5463952,-83.1088033,"unknown",2008,,,"1872 Ring Drive null","Categorized under Pet Shops. Our records show it was established in 2008 and incorporated in Michigan. Current estimates show this company has an annual revenue of $500,000 to $1 million and employs a staff of approximately 1 to 4.",,,,"1 to 4",,,,"https://www.manta.com/c/mm7m0g6/fantasy-pet-products","https://www.manta.com/c/mm7m0g6/fantasy-pet-products","mm7m0g6"
"Griswold Nancy","Washington","8049","509***650***","null","[""Healthcare"",""Offices and Clinics of Health Practitioners, NEC"",""Nurses and Nurses' Registries""]","Spokane","United States","99203",,,,47.628135,-117.3788867,"Unknown",,,,"2214 East 29th Avenue","Categorized under Nurses and Nurses' Registries. Current estimates show this company has an annual revenue of less than $500,000 and employs a staff of approximately 1 to 4.",,,,"1 to 4",,,"Nan***Gri***ld","https://www.manta.com/c/mbd91ng/griswold-nancy","https://www.manta.com/c/mbd91ng/griswold-nancy","mbd91ng"
"Bethany Home","Washington","8059","509***058***","http://www.sp.bestflowers.com","[""Healthcare"",""Nursing Facilities"",""Rest Homes""]","Spokane","United States","99206",,,,47.6969,-117.282525,"Single Location",1924,,,"9111 East Upriver Drive","Categorized under Rest Homes. Our records show it was established in 1924 and incorporated in Washington. Current estimates show this company has an annual revenue of 527832 and employs a staff of approximately 13.",,,"527832","13",,,"Syl*** Sm***","https://www.manta.com/c/mm6prwg/bethany-home","https://www.manta.com/c/mm6prwg/bethany-home","mm6prwg"
"Mdg Barber Inc","Florida","7241","240***873***","null","[""Consumer Services"",""Barber Shops"",""Barbers""]","Navarre","United States","32566",,,,30.430554,-86.916872,"Single Location",2007,,,"2591 Hidden Estates Circle","Categorized under Barbers. Our records show it was established in 2007 and incorporated in FL. Current estimates show this company has an annual revenue of 79958 and employs a staff of approximately 2.",,,"79958","2",,,"Mic***l D***ols***","https://www.manta.com/c/mhxjf0y/mdg-barber-inc","https://www.manta.com/c/mhxjf0y/mdg-barber-inc","mhxjf0y"
"Kirk S Painting LLC","Ohio","1721","614***868***","http://www.kirkspainting.com","[""Construction"",""Painting and Paper Hanging"",""Residential Painters""]","Grove City","United States","43123",,,,39.8913709,-83.0789934,"Single Location",2009,,,"3527 Southwest Court","Categorized under Residential Painters. Our records show it was established in 2009 and incorporated in Ohio. Current estimates show this company has an annual revenue of 235648 and employs a staff of approximately 3.",,,"235648","3",,,"Joh***irk***","https://www.manta.com/c/mtwynvl/kirk-s-painting-llc","https://www.manta.com/c/mtwynvl/kirk-s-painting-llc","mtwynvl"
"Custom Group","Florida","8741","954***475***","http://www.customgroupgc.com","[""Professional Services"",""Management Services"",""Construction Management""]","Deerfield Beach","United States","33442",,,,26.2973385,-80.1508219,"unknown",2011,,,"3458 SW 15th Street null","Categorized under Concrete Repairs. Our records show it was established in 2011 and incorporated in Florida. Current estimates show this company has an annual revenue of 631103 and employs a staff of approximately 3.",,,"631103","3",,,"Ala***osh***","https://www.manta.com/c/mryldz6/custom-group","https://www.manta.com/c/mryldz6/custom-group","mryldz6"
"Spiced Up Brands LLC","Ohio","4215","440***675***","null","[""Car Rental"",""Courier Services Except by Air"",""Vehicular Package Delivery""]","Mentor","United States","44060",,,,41.651748,-81.379521,"Single Location",2019,,,"7329 Mentor Avenue","Categorized under Vehicular Package Delivery. Current estimates show this company has an annual revenue of 54462 and employs a staff of approximately 1.",,,"54462","1",,,,"https://www.manta.com/c/mk1rypf/spiced-up-brands-llc","https://www.manta.com/c/mk1rypf/spiced-up-brands-llc","mk1rypf"
"Allied Commercial & Residential Builders","Ohio","5039","419***616***","http://www.alliedcommercialandresidentialbuilder.com","[""Construction"",""Construction Materials, NEC"",""Construction Materials, Nec""]","Mansfield","United States","44902",,,,40.7456251,-82.5148628,"unknown",2005,,,"455 Hammond Avenue null","Categorized under Commercial and Office Building Contractors. Our records show it was established in 2005 and incorporated in OH. Current estimates show this company has an annual revenue of 700000 and employs a staff of approximately 3.",,,"700000","3",,,"Jef***y S***er","https://www.manta.com/c/mmnwf7c/allied-commercial-residential-builders","https://www.manta.com/c/mmnwf7c/allied-commercial-residential-builders","mmnwf7c"
"Medicare Insurance Advisors Center","Colorado","6321","(80***615***52","http://www.medicareinsurance-advisors.com/",,"Center","United States","66014","{""friday"":false,""monday"":false,""saturday"":false,""sunday"":false,""wednesday"":false}","[""8:00 AM"",""8:00 AM"",""8:00 AM"",""8:00 AM"",""8:00 AM"",""8:00 AM"",""8:00 AM""]","[""9:00 PM"",""9:00 PM"",""9:00 PM"",""9:00 PM"",""9:00 PM"",""9:00 PM"",""9:00 PM""]",39.7852313,-104.9144676,"unknown",,"8:00 AM","9:00 PM","200 Locust St","Medicare is the federal health insurance program
Medicare is the federal health insurance program for people who are at least 65 years old or older and also for people even under 65 years old but with disabilities. These plans are offered by insurance companies and other private companies approved by Medicare. Here in Medicare, a government health insurance program can offer wide coverage. Having this kind of health plan is a big privilege most especially for seniors because this can help them provide hospital and medical coverage. You can also be qualified for an Extra Help Program if you have only a limited income and cannot afford medications. If you�re eligible for Medicare and ready to explore your options, find a plan that works for you.",,,,,,,"Ida***a Z***sa","https://www.manta.com/c/mkbrqgq/medicare-insurance-advisors-center","https://www.manta.com/c/mkbrqgq/medicare-insurance-advisors-center","mkbrqgq"
"John S Price","Ohio","0211","419***748***","null","[""Agriculture"",""Beef Cattle Feedlots"",""Livestock Feeding""]","Mendon","United States","45862",,,,40.713445,-84.485781,"Single Location",1973,,,"8290 State Route 117","Categorized under Livestock Feeding. Our records show it was established in 1973 and incorporated in Ohio. Current estimates show this company has an annual revenue of 70199 and employs a staff of approximately 1.",,,"70199","1",,,"Joh*** Pr***","https://www.manta.com/c/mtmgyw4/john-s-price","https://www.manta.com/c/mtmgyw4/john-s-price","mtmgyw4"
