"company_name","business_state","sic_code","phone_number","website","business_categories","business_city","business_country","business_zip_code","closed_on","opening_hours","closing_hours","latitude","longitude","location_type","year_established","avg_opening_hour","avg_closing_hour","business_street_name","description","services","links","estimated_annual_revenue","num_employees","review_count","reviews","owner","manta_link","url","company_id"
"The Auto Repair Shop","Minnesota","7539","952***353***","http://localgads.com/theautorepairshop","[""Automotive Services"",""Automotive Repair Shops, NEC"",""Automotive Repair Shops""]","Shakopee","United States","55379",,,,44.798427,-93.531057,"unknown",1993,,,"100 Scott Street North null","Categorized under Car Repair and Services. Our records show it was established in 1993 and incorporated in MN. Current estimates show this company has an annual revenue of 386320 and employs a staff of approximately 3.",,,"386320","3",,,"Bre***Ber***nd","https://www.manta.com/c/mm0q69k/the-auto-repair-shop","https://www.manta.com/c/mm0q69k/the-auto-repair-shop","mm0q69k"
"Fayetteville Deliverance Evangelistic Center","North Carolina","8661","910***279***","http://Fdec.org","[""Non-Profit Organizations"",""Religious Organizations"",""Churches""]","Fayetteville","United States","28314",,,,35.0575220970278,-78.986408371228,"unknown",1982,,,"517 Mount Gilead Drive null","Categorized under Pentecostal Church. Our records show it was established in 1982 and incorporated in NC. Current estimates show this company has an annual revenue of 100000 and employs a staff of approximately 1.",,,"100000","1",,,"Jam***E H***on","https://www.manta.com/c/mmyw86m/fayetteville-deliverance-evangelistic-center","https://www.manta.com/c/mmyw86m/fayetteville-deliverance-evangelistic-center","mmyw86m"
"Speedway Auto Sales LLC","Nevada","5511","702***388***","null","[""Automotive Services"",""Motor Vehicle Dealers (New and Used)"",""Used Car Dealers""]","North Las Vegas","United States","89030",,,,36.240195,-115.09089,"Single Location",2018,,,"3873 East Craig Road # 2","Categorized under Used Car Dealers. Current estimates show this company has an annual revenue of 217492 and employs a staff of approximately 6.",,,"217492","6",,,"Mad***ne ***che***","https://www.manta.com/c/mkh7cd9/speedway-auto-sales-llc","https://www.manta.com/c/mkh7cd9/speedway-auto-sales-llc","mkh7cd9"
"Fugate Ornamental Iron","Oklahoma","7212","(91***203***44","http://fugateornamentaliron.com/","[""Consumer Services"",""Garment Pressing, and Agents for Laundries and Drycleaners"",""Ironing Services""]","Bartlesville","United States","74003","{""friday"":false,""monday"":false,""saturday"":true,""sunday"":true,""wednesday"":false}","[""CLOSED"",""8:00 AM"",""8:00 AM"",""8:00 AM"",""8:00 AM"",""8:00 AM"",""CLOSED""]","[""CLOSED"",""5:00 PM"",""5:00 PM"",""5:00 PM"",""5:00 PM"",""5:00 PM"",""CLOSED""]",36.743841,-95.9692,"unknown",,"8:00 AM","5:00 PM","825 S Seneca Ave","We fabricate high end ornamental iron: stair rails, guard rails, drive and garden gates, fences, etc.
We love to forge your dreams with custom hand forged scrolls and accents using original designs with your tastes in mind.","[""Fence Installation"",""Fence Contractor"",""Stair Rails Manufacturer"",""Iron Fence Installation"",""Custom Furniture Contractor"",""Iron gates"",""Iron Works Contractor"",""Iron Works"",""Custom Iron Works"",""Garden Gate Mounting"",""Iron Rails Crafting""]","{""facebook"":""http://www.facebook.com/Fugate-Ornamental-Iron-1711314159184820"",""twitter"":""https://www.twitter.com/FugateOrnament""}",,,,,"Tim***y F***te","https://www.manta.com/c/mx6g7vz/fugate-ornamental-iron","https://www.manta.com/c/mx6g7vz/fugate-ornamental-iron","mx6g7vz"
"GutterGuys Premium Exterior Products","South Carolina","7319","843***519***","http://gutterguyssc.com/","[""Advertising and Marketing"",""Advertising, NEC"",""Distribution of advertising material or sample services""]","Florence","United States","29501","{""friday"":false,""monday"":false,""saturday"":false,""sunday"":false,""wednesday"":false}","[null,null,null,null,null,null,null]","[null,null,null,null,null,null,null]",34.186635,-79.8766771,"Single Location",2019,,,"636 Dunwoody Road","
Does your mulch wash away every time it storms? Have you noticed rotting wood around your roof? GutterGuys SC LLC offers gutter repair and installation services in the Florence, South Carolina area. 

We do our best to protect your residential property with aluminum or copper gutters. We'll install gutters that enhance your home's exterior appearance while providing the protection it needs. Contact GutterGuys SC today for gutter installations in Florence, SC and beyond.",,,"61917","1",,,"Jer*** Ca***ll","https://www.manta.com/c/mkbbq37/gutterguys-premium-exterior-products","https://www.manta.com/c/mkbbq37/gutterguys-premium-exterior-products","mkbbq37"
"Hayhurst Rentals LLC","West Virginia","7359","304***389***","null","[""Construction"",""Equipment Rental and Leasing, NEC"",""Yard Equipment Rental Stores""]","Chester","United States","26034",,,,40.560437,-80.570663,"Single Location",2010,,,"2173 Shepherds Valley Road","Categorized under Yard Equipment Rental Stores. Our records show it was established in 2010 and incorporated in West Virginia. Current estimates show this company has an annual revenue of 133473 and employs a staff of approximately 2.",,,"133473","2",,,"Ken***h H***urs***","https://www.manta.com/c/mryc8vc/hayhurst-rentals-llc","https://www.manta.com/c/mryc8vc/hayhurst-rentals-llc","mryc8vc"
"Px Transportation Inc","Texas","4213","******","null","[""Car Rental"",""Trucking, Except Local"",""Trucking""]","Midlothian","United States","76065",,,,32.4757,-96.9936,"Single Location",2004,,,"4522 Pecan Creek Drive","Categorized under Trucking. Our records show it was established in 2004 and incorporated in Texas. Current estimates show this company has an annual revenue of 250000 and employs a staff of approximately 2.",,,"250000","2",,,"Fra***A P***er","https://www.manta.com/c/mr5b02b/px-transportation-inc","https://www.manta.com/c/mr5b02b/px-transportation-inc","mr5b02b"
"All Kids 1st Learning Academy","Texas","7389","210***2-7***","http://www.allkids1stlearningacademysa.com","[""Business Services"",""Business Services, NEC"",""Business services, nec""]","San Antonio","United States","78218","{""friday"":false,""monday"":false,""saturday"":false,""sunday"":false,""wednesday"":false}","[null,null,null,null,null,null,null]","[null,null,null,null,null,null,null]",29.48544,-98.4195,"unknown",,,,"270 Antrim Drive",,,,,,,,"Deb***Mar***ez","https://www.manta.com/c/mxfsjll/all-kids-1st-learning-academy","https://www.manta.com/c/mxfsjll/all-kids-1st-learning-academy","mxfsjll"
"Ods Airport Shuttle","Nevada","4581","702***108***","http://odslimo.com","[""Car Rental"",""Airports, Flying Fields, and Airport Terminal Services"",""Airport Terminal Services""]","Las Vegas","United States","89103",,,,36.104908,-115.195751,"unknown",2015,,,"4675 Wynn Road null","Categorized under Limousine Services. Current estimates show this company has an annual revenue of 86686 and employs a staff of approximately 4.",,,"86686","4",,,"Bra***ala***","https://www.manta.com/c/mmzfhk1/ods-airport-shuttle","https://www.manta.com/c/mmzfhk1/ods-airport-shuttle","mmzfhk1"
"Matson Logistics, Inc","Georgia","4731","678***320***","http://www.matson.com","[""Car Rental"",""Freight Cargo Logistics"",""Freight Forwarding""]","Marietta","United States","30067",,,,33.9199175,-84.4871832,"Branch",,,,"2275 Northwest Parkway Se # 115","Categorized under Freight Forwarding. Current estimates show this company has an annual revenue of $500,000 to $1 million and employs a staff of approximately 5 to 9.",,,,"5 to 9",,,"Sha*** Gi***rt","https://www.manta.com/c/mmdwyw2/matson-logistics-inc","https://www.manta.com/c/mmdwyw2/matson-logistics-inc","mmdwyw2"
"Securus Payments","Oregon","7322","866***132***","null","[""Professional Services"",""Adjustment and Collection Services"",""Collection Agency, Except Real Estate""]","Portland","United States","97266",,,,45.4762,-122.5596,"Single Location",2013,,,"7724 Se Aspen Summit Drive 300","Categorized under Collection Agency, Except Real Estate. Our records show it was established in 2013 and incorporated in Oregon. Current estimates show this company has an annual revenue of 310000 and employs a staff of approximately 8.",,,"310000","8",,,,"https://www.manta.com/c/mb4nw8b/securus-payments","https://www.manta.com/c/mb4nw8b/securus-payments","mb4nw8b"
"Smith George CPA","Illinois","8721","708***340***","null","[""Professional Services"",""Accounting, Auditing, and Bookkeeping Services"",""Certified Management Accountants""]","Orland Park","United States","60467",,,,41.6018,-87.8899,"Unknown",1975,,,"11508 West 183rd Street Sw","Categorized under Certified Management Accountants. Our records show it was established in 1975 and incorporated in Illinois. Current estimates show this company has an annual revenue of less than $500,000 and employs a staff of approximately 1 to 4.",,,,"1 to 4",,,"Geo*** Sm***","https://www.manta.com/c/mmqwtjf/smith-george-cpa","https://www.manta.com/c/mmqwtjf/smith-george-cpa","mmqwtjf"
"Alliance Logistics","California","4789","562***747***","null","[""Car Rental"",""Transportation Services, NEC"",""Transportation""]","Pico Rivera","United States","90660",,,,34.0132919,-118.0894167,"Single Location",2016,,,"9935 Beverly Boulevard","Categorized under Transportation. Current estimates show this company has an annual revenue of 66885 and employs a staff of approximately 2.",,,"66885","2",,,,"https://www.manta.com/c/mhq1gsk/alliance-logistics","https://www.manta.com/c/mhq1gsk/alliance-logistics","mhq1gsk"
"HearingLife","Minnesota","8049","218***885***","https://www.hearinglife.com/hearing-aids-centers/minnesota/cloquet","[""Healthcare"",""Offices and Clinics of Health Practitioners, NEC"",""Audiologist""]","Cloquet","United States","55720","{""friday"":false,""monday"":false,""saturday"":false,""sunday"":false,""wednesday"":false}","[null,null,""09:00AM"",null,""09:00AM"",null,null]","[null,null,""05:00PM"",null,""05:00PM"",null,null]",46.7214058,-92.450097,"unknown",,"09:00AM","05:00PM","4 13th Street","Welcome to HearingLife in Cloquet! We offer free hearing assessments and risk-free hearing aid trials with professional, personalized care.
At HearingLife, we are committed to delivering unsurpassed hearing healthcare by placing your individual needs first. We provide the best hearing aids, including invisible hearing aids, and our hearing care is supported by our professional and dedicated staff. We have hearing aids available at a variety of price-points and flexible financing options. Our vision is: Helping more people hear better.",,"{""facebook"":""https://www.facebook.com/HearingLifeCloquetMN"",""twitter"":""https://www.twitter.com/HearingLife""}",,,,,,"https://www.manta.com/c/m1rxsdw/hearinglife","https://www.manta.com/c/m1rxsdw/hearinglife","m1rxsdw"
"Dental & Vision Associates","Connecticut","8042","860***139***","http://dentalandvisionassoc.com/","[""Healthcare"",""Offices and Clinics of Optometrists"",""Specialized optometrists""]","Wethersfield","United States","06109","{""friday"":false,""monday"":false,""saturday"":false,""sunday"":false,""wednesday"":false}","[""9:00 AM"",""9:00 AM"",""9:00 AM"",""9:00 AM"",""9:00 AM"",""9:00 AM"",""9:00 AM""]","[""6:00 PM"",""6:00 PM"",""6:00 PM"",""6:00 AM"",""6:00 PM"",""5:00 PM"",""3:00 PM""]",41.7174874,-72.69360110000002,"HQ",2003,"9:00 AM","6:00 AM","1402 Berlin Turnpike","Dental & Vision Associates
Located in Wethersfield, CT, our doctors are committed to your individual attention and strive to provide personalized dental and ocular healthcare tailored for your unique needs and goals. 

We offer a variety of services to meet your needs such as 
preventative, restorative and cosmetic dentistry. We also offer comprehensive eye exams, contacts and an optical center.",,,,,,,"Phu*** Ng***n","https://www.manta.com/c/mm06vwg/dental-vision-associates","https://www.manta.com/c/mm06vwg/dental-vision-associates","mm06vwg"
"DKW Logistics","Georgia","4225","912***510***","http://dkwlogistics.com","[""Storage"",""General Warehousing and Storage"",""Storage""]","Ellabell","United States","31308",,,,32.1680187609752,-81.4396172721234,"unknown",,,,"1650 Oracal Parkway null","Categorized under Transportation. Current estimates show this company has an annual revenue of less than $500,000 and employs a staff of approximately 1 to 4.",,,,"1 to 4",,,"Den*** Wa***n","https://www.manta.com/c/mtmbx1z/dkw-logistics","https://www.manta.com/c/mtmbx1z/dkw-logistics","mtmbx1z"
"Fabre Betty M","Texas","8322","512***844***","http://Hillcountrycmhc.com","[""Non-Profit Organizations"",""Individual and Family Social Services"",""Social Workers""]","Austin","United States","78758",,,,30.360365,-97.7158869,"Unknown",,,,"1433 Fairfield Drive","Categorized under Social Workers. Current estimates show this company has an annual revenue of unknown and employs a staff of approximately 1 to 4.",,,,"1 to 4",,,"Bet***Fab***","https://www.manta.com/c/mbdtq8h/fabre-betty-m","https://www.manta.com/c/mbdtq8h/fabre-betty-m","mbdtq8h"
"Market America","New York","5199","914***1-0***","http://www.shop.com/jasbest","[""Electronics and Home Appliances"",""Miscellaneous Nondurable Goods"",""Variety store merchandise""]","New Rochelle","United States","10801","{""friday"":false,""monday"":false,""saturday"":false,""sunday"":false,""wednesday"":false}","[null,null,null,null,null,null,null]","[null,null,null,null,null,null,null]",,,"unknown",,,,,,,,,"undefined",,,"Arl*** Ro***son***","https://www.manta.com/c/mx2bf91/market-america","https://www.manta.com/c/mx2bf91/market-america","mx2bf91"
"test","Ohio","7389","555***830***","null","[""Business Services"",""Business Services, NEC"",""Business services, nec""]","Columbus","United States","43214","{""friday"":false,""monday"":false,""saturday"":false,""sunday"":false,""wednesday"":false}","[null,null,null,null,null,null,null]","[null,null,null,null,null,null,null]",39.9565424,-82.996036,"unknown",,,,"123 main st",,,,,,,,"bun*** te***ng","https://www.manta.com/c/mx4zr5g/test","https://www.manta.com/c/mx4zr5g/test","mx4zr5g"
"Heidi Allan Wellness Practitioner","Utah","8999","(80***628***53","http://heidiallan.com","[""Business Services"",""Services, NEC"",""Personal services""]","Saratoga Springs","United States","84045","{""friday"":false,""monday"":false,""saturday"":false,""sunday"":false,""wednesday"":false}","[null,null,null,null,null,null,null]","[null,null,null,null,null,null,null]",40.320441,-111.90758299999999,"unknown",,,,"2296 Browning Dr","Heidi Allan Wellness Practitioner offers a number of personal services to help clients improve their overall health and wellbeing.
My name is Heidi Allan and I am an experienced practitioner of alternative healing with much to offer to clients in Saratoga Springs and the surrounding cities. I specialize in personal coaching and Autonomic Response Testing. My services are aimed at helping individuals examine their physical and emotional health, set tangible goals and take the steps to achieve those goals.",,,,,,,"Hei***All***","https://www.manta.com/c/mhcrjkc/heidi-allan-wellness-practitioner","https://www.manta.com/c/mhcrjkc/heidi-allan-wellness-practitioner","mhcrjkc"
"Cameo Entertainment Group","Massachusetts","4832","(61***328***75","http://www.cyberstationusa.com","[""Cable and Telecom Services"",""Radio Broadcasting Stations"",""Radio broadcasting stations""]","Quincy","United States","02169","{""friday"":false,""monday"":false,""saturday"":false,""sunday"":false,""wednesday"":false}","[""12:00 PM"",""10:00 AM"",""10:00 AM"",""10:00 AM"",""10:00 AM"",""10:00 AM"",""9:00 AM""]","[""9:00 PM"",""11:00 PM"",""11:00 PM"",""11:00 PM"",""11:00 PM"",""11:00 PM"",""6:00 PM""]",42.24933,-71.003,"HQ",1995,"10:00 AM","11:00 PM","12 Granite St","CyberStationUSA.Com is the world's largest online radio station, with millions of listeners, and home to many of the most well known broadcasters.
Cameo Entertainment Group owns and operates CyberStationUSA.Com, the world's largest, privately held exclusive online radio station with millions of listeners worldwide.

CyberStationUSA.Com is home to some of the most well known broadcasters and shows in the radio industry, including: Mike Siegel; Don Eckers and Dark Matters Radio; Peter Anthony Holder and The Stuph File Program; Brother Don Steele and The Sunday Services; On The Street with Wayne Metrano, and many, many more. 

CyberStationUSA.Com is also home to some of the largest companies in the advertising world, as CyberStationUSA represents a completely integrated, one-stop-shop for advertisers seeking a highly engaging platform that reaches their targeted consumers AND provides exceptionally high ROI.","[""radio program production"",""advertising services""]","{""facebook"":""http://www.facebook.com/group.php?v=info&gid=75339171963"",""twitter"":""https://www.twitter.com/cyberstationusa""}",,"100 to 249",,,"Jer*** La***","https://www.manta.com/c/mmlpfy6/cameo-entertainment-group","https://www.manta.com/c/mmlpfy6/cameo-entertainment-group","mmlpfy6"
"Garrison Water Treatment Plant","North Dakota","9631","701***273***","null","[""Government"",""Regulation and Administration of Communications, Electric, Gas, and Other Utilities"",""City Govt-Regulation/Adm-Comms/Utilities""]","Garrison","United States","58540",,,,47.64928,-101.42351,"Unknown",,,,"149 1 2 4th Street Sw","Categorized under City Govt-Regulation/Adm-Comms/Utilities. Current estimates show this company has an annual revenue of unknown and employs a staff of approximately 1 to 4.",,,,"1 to 4",,,"All***Bey***s","https://www.manta.com/c/mmzwdqh/garrison-water-treatment-plant","https://www.manta.com/c/mmzwdqh/garrison-water-treatment-plant","mmzwdqh"
"Overland Engineering","Missouri","8711","417***815***","https://www.theoverlandgroup.com","[""Professional Services"",""Engineering Services"",""Engineers""]","West Plains","United States","65775",,,,36.7449244220793,-91.8741082570734,"unknown",,,,"1598 Imperial Center # 2009 null","Categorized under Engineers. Current estimates show this company has an annual revenue of less than $500,000 and employs a staff of approximately 1 to 4.",,,,"1 to 4",,,,"https://www.manta.com/c/mb8krlh/overland-engineering","https://www.manta.com/c/mb8krlh/overland-engineering","mb8krlh"
"Maloy Automotive","Alabama","5511","205***490***","null","[""Automotive Services"",""Motor Vehicle Dealers (New and Used)"",""Car Dealers""]","Jasper","United States","35504",,,,33.86587,-87.22548,"Unknown",,,,"2403 Oakridge Circle","Categorized under Car Dealers. Current estimates show this company has an annual revenue of $2.5 to 5 million and employs a staff of approximately 5 to 9.",,,,"5 to 9",,,,"https://www.manta.com/c/mbd87ym/maloy-automotive","https://www.manta.com/c/mbd87ym/maloy-automotive","mbd87ym"
"Lane Featherbed Association","Vermont","8699","802***655***","null","[""Non-Profit Organizations"",""Membership Organizations, NEC"",""Membership Organizations, Nec""]","South Hero","United States","05486",,,,44.6458214,-73.270348,"Single Location",2010,,,"108 Featherbed Lane","Categorized under Membership Organizations, Nec. Our records show it was established in 2010 and incorporated in Vermont. Current estimates show this company has an annual revenue of 51555 and employs a staff of approximately 2.",,,"51555","2",,,"Dav***C C***er","https://www.manta.com/c/mr5g5y7/lane-featherbed-association","https://www.manta.com/c/mr5g5y7/lane-featherbed-association","mr5g5y7"
"Artcolab LLC","Idaho","7336","208***015***","http://www.artcolab.com","[""Printing Services"",""Commercial Art and Graphic Design"",""Graphic Services""]","Coeur D Alene","United States","83814",,,,47.675476,-116.787241,"Single Location",2013,,,"250 Northwest Boulevard 101b","Categorized under Graphic Services. Our records show it was established in 2013 and incorporated in ID. Current estimates show this company has an annual revenue of 58081 and employs a staff of approximately 1.",,,"58081","1",,,"Sco***Lak***","https://www.manta.com/c/mhzwr8f/artcolab-llc","https://www.manta.com/c/mhzwr8f/artcolab-llc","mhzwr8f"
"Perry Investment Properties, LLC","West Virginia","6512","304***564***","null","[""Real Estate"",""Operators of Nonresidential Buildings"",""Operators of Nonresidential Buildings""]","Barboursville","United States","25504",,,,38.415054,-82.298786,"Single Location",2010,,,"6433 Us Route 60 East # 100","Categorized under Operators of Nonresidential Buildings. Our records show it was established in 2010 and incorporated in WV. Current estimates show this company has an annual revenue of 278634 and employs a staff of approximately 3.",,,"278634","3",,,"Joh*** Pe*** Ii***","https://www.manta.com/c/mr4dbzy/perry-investment-properties-llc","https://www.manta.com/c/mr4dbzy/perry-investment-properties-llc","mr4dbzy"
"Kiamichi Technology Center","Oklahoma","8249","580***635***","http://www.okktc.org","[""Educational Services"",""Vocational Schools, NEC"",""Technical Schools and Trade Schools""]","Antlers","United States","74523",,,,34.2353908,-95.6404271,"unknown",,,,"405 SW O Street null","Categorized under Technical Institute. Current estimates show this company has an annual revenue of $500,000 to $1 million and employs a staff of approximately 5 to 9.",,,,"5 to 9",,,"Cha***s W***en","https://www.manta.com/c/mtm5t2z/kiamichi-technology-center","https://www.manta.com/c/mtm5t2z/kiamichi-technology-center","mtm5t2z"
"BW Fencing","California","1799","619***234***","http://www.bwfencing.net","[""Construction"",""Special Trade Contractors, NEC"",""Fence Contractors""]","El Cajon","United States","92021",,,,32.820274,-116.9124949,"unknown",2008,,,"1869 Lavala Lane null","Categorized under Fence Contractors. Our records show it was established in 2008 and incorporated in CA. Current estimates show this company has an annual revenue of 167113 and employs a staff of approximately 2.",,,"167113","2",,,"Rob*** J ***tne***","https://www.manta.com/c/mtm5lnn/bw-fencing","https://www.manta.com/c/mtm5lnn/bw-fencing","mtm5lnn"
"Gandrud Chevrolet","Wisconsin","5511","(92***468***00","https://www.gandrudchevrolet.com/","[""Automotive Services"",""Motor Vehicle Dealers (New and Used)"",""Automobiles, new and used""]","Green Bay","United States","54302","{""friday"":false,""monday"":false,""saturday"":false,""sunday"":true,""wednesday"":false}","[""CLOSED"",""8:30 AM"",""8:30 AM"",""8:30 AM"",""8:30 AM"",""8:30 AM"",""8:30 AM""]","[""CLOSED"",""7:00 PM"",""7:00 PM"",""7:00 PM"",""7:00 PM"",""6:00 PM"",""5:00 PM""]",44.484162,-87.966199,"unknown",,"8:30 AM","7:00 PM","3792 919 Auto Plaza Dr","Green Bay's trusted Chevrolet dealership with a full range of vehicles, genuine parts, and expert auto service. Express Service is open on Saturdays.
For a diverse selection of new and used Chevrolet cars, trucks, and SUVs, visit Gandrud Chevrolet in Green Bay, WI. Their knowledgeable staff prioritizes customer satisfaction, providing honest guidance to help you choose the right vehicle for your needs. Gandrud Chevrolet also offers comprehensive auto service, genuine OEM parts, financing options, and more. Concerning Service at our location - the main service shop and parts department is no longer open on Saturdays, but the Express Service is open on Saturdays.",,,,,,,,"https://www.manta.com/c/mmf8skv/gandrud-chevrolet","https://www.manta.com/c/mmf8skv/gandrud-chevrolet","mmf8skv"
"Carolina Healthy Skin","North Carolina","8011","910***841***","http://www.carolinahealthyskin.com","[""Healthcare"",""Offices and Clinics of Doctors of Medicine"",""Dermatologist""]","West End","United States","27376","{""friday"":false,""monday"":false,""saturday"":true,""sunday"":true,""wednesday"":false}","[""CLOSED"",""08:00AM"",""08:00AM"",""08:00AM"",""08:00AM"",""08:00AM"",""CLOSED""]","[""CLOSED"",""04:30PM"",""04:30PM"",""04:30PM"",""04:30PM"",""12:30PM"",""CLOSED""]",35.263606,-79.586115,"unknown",,"08:00AM","04:30PM","145 West Plaza Drive","Achieve healthy skin with expert care at the Dermatology & Skin Surgery Center!
The Dermatology & Skin Surgery Center of North Carolina, founded by Dr. J. Todd Williams in 1997, is a premier dermatology practice with 6 locations serving Central North Carolina. Offering comprehensive services in Clinical, Surgical, and Cosmetic Dermatology, the center excels in skin cancer treatment, including Mohs Surgery, and provides advanced care for conditions like acne, eczema, and psoriasis. The practice is especially known for its expertise in Accutane therapy, ensuring patients achieve lasting results. With a team of 17 skilled providers, patients receive personalized care tailored to their unique needs. Visit us today for compassionate, state-of-the-art dermatological care.",,,,,,,,"https://www.manta.com/c/m1xbmgw/carolina-healthy-skin","https://www.manta.com/c/m1xbmgw/carolina-healthy-skin","m1xbmgw"
"Quaker State Quick Lube & Carwash","Michigan","7539","989***699***","null","[""Automotive Services"",""Automotive Repair Shops, NEC"",""Automotive Tune-Up Services""]","Alma","United States","48801",,,,43.3911438,-84.6666611,"unknown",,,,"1360 Wright Avenue null","Categorized under Lubrication service, automotive. Current estimates show this company has an annual revenue of $500,000 to $1 million and employs a staff of approximately 5 to 9.",,,,"5 to 9",,,"Gre***arr***","https://www.manta.com/c/mm3xtrt/quaker-state-quick-lube-carwash","https://www.manta.com/c/mm3xtrt/quaker-state-quick-lube-carwash","mm3xtrt"
