"company_name","business_state","sic_code","phone_number","website","business_categories","business_city","business_country","business_zip_code","closed_on","opening_hours","closing_hours","latitude","longitude","location_type","year_established","avg_opening_hour","avg_closing_hour","business_street_name","description","services","links","estimated_annual_revenue","num_employees","review_count","reviews","owner","manta_link","url","company_id"
"Stacks Pancake House Bettendorf","Iowa","5812","563***800***","https://www.stackspancakehousebettendorf.com/","[""Restaurants and Bars"",""Restaurants"",""Eating places""]","Bettendorf","United States","52722","{""friday"":false,""monday"":false,""saturday"":false,""sunday"":false,""wednesday"":false}","[""07:00AM"",""07:00AM"",""07:00AM"",""07:00AM"",""07:00AM"",""07:00AM"",""07:00AM""]","[""02:00PM"",""02:00PM"",""02:00PM"",""02:00PM"",""02:00PM"",""02:00PM"",""02:00PM""]",41.5261899,-90.5091752,"unknown",,"07:00AM","02:00PM","1661 Grant Street","Visit our pancake house in Bettendorf, IA today. Our breakfast menu is available all day.
The most important meal of the day deserves to be done right, and that's why you'll want to have lunch at Stacks Pancake House Bettendorf. Whether you're craving something sweet or savory, you'll love what we're serving. We're known for our incredible crêpes and pancakes, but our menu doesn't stop there. Be sure to try our delicious burgers, fresh salads, hearty sandwiches, and much more!",,,,,,,,"https://www.manta.com/c/m1wpw09/stacks-pancake-house-bettendorf","https://www.manta.com/c/m1wpw09/stacks-pancake-house-bettendorf","m1wpw09"
"Paul Andrews Phd","Texas","8049","903***208***","null","[""Healthcare"",""Offices and Clinics of Health Practitioners, NEC"",""Psychologists""]","Tyler","United States","75702",,,,32.3438207,-95.2981095,"Single Location",1994,,,"306 East Houston Street","Categorized under Psychologists. Our records show it was established in 1994 and incorporated in Texas. Current estimates show this company has an annual revenue of 60190 and employs a staff of approximately 1.",,,"60190","1",,,"Pau***ndr***","https://www.manta.com/c/mm0bcxb/paul-andrews-phd","https://www.manta.com/c/mm0bcxb/paul-andrews-phd","mm0bcxb"
"Dish Society - West U","Texas","5812","713***273***","http://www.dishsociety.com/location/dish-society-west-u/","[""Restaurants and Bars"",""Restaurants"",""American restaurant""]","Houston","United States","77025","{""friday"":false,""monday"":false,""saturday"":false,""sunday"":false,""wednesday"":false}","[""8:00 AM"",""8:00 AM"",""8:00 AM"",""8:00 AM"",""8:00 AM"",""8:00 AM"",""8:00 AM""]","[""9:00 PM"",""9:00 PM"",""9:00 PM"",""9:00 PM"",""9:00 PM"",""10:00 PM"",""10:00 PM""]",29.7048639,-95.4447766,"unknown",2013,"8:00 AM","9:00 PM","4191 Bellaire Blvd Suite #180","Dish Society is a counter service for breakfast, lunch, and brunch, and full service for supper and social hour.
Dedicated to using the highest quality and freshest ingredients possible, Dish Society sources a majority of its items locally from suppliers such as Atkinson Farms, Black Hill Ranch, Ives Creek Organics, and Slow Dough Bread Company, among others. The all-day diner turns out a seasonally changing menu with healthful modern twists on traditional favorites. In addition to the robust coffee program by Greenway Coffee, guests can enjoy healthful juices and elixirs, a rotating selection of local craft beers, an approachable wine list, and handcrafted cocktails served in a modern industrial atmosphere.","[""american restaurant"","" dish society"","" farm to table"",""houston brunch"",""american food houston""]","{""facebook"":""http://www.facebook.com/DishSociety/"",""twitter"":""https://www.twitter.com/dishsociety""}",,,,,"Aar***Lyo***","https://www.manta.com/c/mk28h13/dish-society-west-u","https://www.manta.com/c/mk28h13/dish-society-west-u","mk28h13"
"Speights & Worrich Blanco","Texas","8111","210***678***","http://www.speightsfirm.com","[""Legal"",""Legal Services"",""Law Firms and Law Offices""]","San Antonio","United States","78216",,,,29.5220658,-98.5057527,"unknown",,,,"14235 Blanco Road null","Categorized under Lawyers and Attorneys. Current estimates show this company has an annual revenue of less than $500,000 and employs a staff of approximately 1 to 4.",,,,"1 to 4",,,,"https://www.manta.com/c/mbnsfdj/speights-worrich-blanco","https://www.manta.com/c/mbnsfdj/speights-worrich-blanco","mbnsfdj"
"AM PM Pizza Bagel","New York","5812","347***486***","null","[""Restaurants and Bars"",""Restaurants"",""Pizza""]","Brooklyn","United States","11223",,,,40.6085254,-73.973265,"unknown",2010,,,"1810 McDonald Avenue null","Categorized under Bagels. Our records show it was established in 2010 and incorporated in New York. Current estimates show this company has an annual revenue of 65000 and employs a staff of approximately 2.",,,"65000","2",,,,"https://www.manta.com/c/mrs0ys6/am-pm-pizza-bagel","https://www.manta.com/c/mrs0ys6/am-pm-pizza-bagel","mrs0ys6"
"Vista Gardens Home Owners Association Guards Booth","Maryland","8699","301***911***","http://www.site-unavailable.com","[""Non-Profit Organizations"",""Membership Organizations, NEC"",""Organizations""]","Bowie","United States","20720",,,,38.950855,-76.826228,"unknown",2007,,,"10400 Vista Gardens Drive null","Categorized under Homeowners' Association. Our records show it was established in 2007 and incorporated in Maryland. Current estimates show this company has an annual revenue of 71689 and employs a staff of approximately 3.",,,"71689","3",,,"Mar***ll ***ton***","https://www.manta.com/c/mtw15x2/vista-gardens-home-owners-association-guards-booth","https://www.manta.com/c/mtw15x2/vista-gardens-home-owners-association-guards-booth","mtw15x2"
"Journey Social LLC","Oregon","7374","541***164***","http://journeysocial.com","[""Information Technology"",""Computer Processing and Data Preparation and Processing Services"",""Web Design and Web Development""]","Bend","United States","97702","{""friday"":false,""monday"":false,""saturday"":false,""sunday"":false,""wednesday"":false}","[null,null,null,null,null,null,null]","[null,null,null,null,null,null,null]",44.0223,-121.2985,"unknown",,,,"790 SW Industrial Way Ste 210",,,,,,,,,"https://www.manta.com/c/mx4lpk8/journey-social-llc","https://www.manta.com/c/mx4lpk8/journey-social-llc","mx4lpk8"
"Bankers Business Management Services","Maryland","8748","301***012***","http://www.bankersbms.com","[""Professional Services"",""Business Consulting Services, NEC"",""Business Consulting, Nec, Nec""]","Silver Spring","United States","20910",,,,39.0024246,-77.0349216,"unknown",1982,,,"8121 Georgia Avenue # 950 null","Categorized under Courier Services. Our records show it was established in 1982 and incorporated in MD. Current estimates show this company has an annual revenue of 9771292 and employs a staff of approximately 115.",,,"9771292","115",,,"Mus*** Be***","https://www.manta.com/c/mm25gx1/bankers-business-management-services","https://www.manta.com/c/mm25gx1/bankers-business-management-services","mm25gx1"
"Lee Landing Condominium","Virginia","6531","703***903***","null","[""Real Estate"",""Real Estate Agents and Managers"",""Real Estate""]","Falls Church","United States","22042",,,,38.87707,-77.210272,"unknown",2011,,,"2810 Emma Lee Street null","Categorized under Condominium Developers. Our records show it was established in 2011 and incorporated in Virginia. Current estimates show this company has an annual revenue of $1 to 2.5 million and employs a staff of approximately 5 to 9.",,,,"5 to 9",,,,"https://www.manta.com/c/mm6y424/lee-landing-condominium","https://www.manta.com/c/mm6y424/lee-landing-condominium","mm6y424"
"Good Foundation Preschool","New York","8351","718***150***","http://Agoodfoundationacademy.com","[""Consumer Services"",""Child Day Care Services"",""Pre-Schools""]","Jamaica","United States","11412",,,,40.693422,-73.755804,"Single Location",1996,,,"19604 Linden Boulevard # B","Categorized under Pre-Schools. Our records show it was established in 1996 and incorporated in New York. Current estimates show this company has an annual revenue of 420000 and employs a staff of approximately 12.",,,"420000","12",,,"Chr***ine***uis***","https://www.manta.com/c/mm5gdww/good-foundation-preschool","https://www.manta.com/c/mm5gdww/good-foundation-preschool","mm5gdww"
"Cedar City Orthopedic Surgery","Utah","8011","435***267***","null","[""Healthcare"",""Offices and Clinics of Doctors of Medicine"",""Doctors""]","Boulder","United States","84716",,,,37.8993432,-111.4164946,"Unknown",,,,,"Categorized under Doctors. Current estimates show this company has an annual revenue of $500,000 to $1 million and employs a staff of approximately 1 to 4.",,,,"1 to 4",,,,"https://www.manta.com/c/mbswgh8/cedar-city-orthopedic-surgery","https://www.manta.com/c/mbswgh8/cedar-city-orthopedic-surgery","mbswgh8"
"Central Security Life Insurance Company","Texas","6311","972***277***","http://www.centralsecuritylife.com","[""Insurance"",""Life Insurance"",""Life reinsurance carriers""]","Richardson","United States","75082","{""friday"":false,""monday"":false,""saturday"":false,""sunday"":false,""wednesday"":false}","[null,null,null,null,null,null,null]","[null,null,null,null,null,null,null]",32.979385,-96.706107,"Headquarters",1988,,,"2185 North Glenville Drive","Central Security Life Insurance Company",,,,,,,"Wil***m H***wis*********H L******","https://www.manta.com/c/mm2ggf2/central-security-life-insurance-company","https://www.manta.com/c/mm2ggf2/central-security-life-insurance-company","mm2ggf2"
"Write Expression","Delaware","8999","302***275***","null","[""Business Services"",""Services, NEC"",""Artist's Studio""]","Rehoboth Beach","United States","19971",,,,38.697171,-75.081898,"Single Location",1985,,,"306 Bayview Avenue","Categorized under Artist's Studio. Our records show it was established in 1985 and incorporated in Delaware. Current estimates show this company has an annual revenue of 33526 and employs a staff of approximately 1.",,,"33526","1",,,"Joa***Def***e","https://www.manta.com/c/mmcw0vv/write-expression","https://www.manta.com/c/mmcw0vv/write-expression","mmcw0vv"
"B & L Welding","Illinois","5084","309***466***","null","[""Industrial Machinery"",""Industrial Machinery and Equipment"",""Wholesale Welding Equipment and Supplies""]","Peoria","United States","61602",,,,40.71638,-89.5598,"Unknown",,,,"3025 Sw Adams Street","Categorized under Wholesale Welding Equipment and Supplies. Current estimates show this company has an annual revenue of $5 to 10 million and employs a staff of approximately 1 to 4.",,,,"1 to 4",,,,"https://www.manta.com/c/mbd6d16/b-l-welding","https://www.manta.com/c/mbd6d16/b-l-welding","mbd6d16"
"Auto Unlimited","Texas","5511","806***905***","http://autounlimitedinc.com","[""Automotive Services"",""Motor Vehicle Dealers (New and Used)"",""Used Car Dealers""]","Amarillo","United States","79101",,,,35.2036819,-101.8325398,"unknown",2013,,,"905 South Buchanan Street null","Categorized under Car Repair and Services. Our records show it was established in 2013 and incorporated in Texas. Current estimates show this company has an annual revenue of 189271 and employs a staff of approximately 2.",,,"189271","2",,,"Joh***e S***non***","https://www.manta.com/c/mm3zn0c/auto-unlimited","https://www.manta.com/c/mm3zn0c/auto-unlimited","mm3zn0c"
"Tegeler Chevrolet","Texas","5511","979***405***","http://www.tegelerchevrolet.com","[""Automotive Services"",""Motor Vehicle Dealers (New and Used)"",""Car Dealers""]","Industry","United States","78944",,,,29.9725274244215,-96.5034612520022,"unknown",2005,,,"17114 Highway 159 null","Categorized under Car Dealers. Our records show it was established in 2005 and incorporated in Texas. Current estimates show this company has an annual revenue of $5 to 10 million and employs a staff of approximately 10 to 19.",,,,"10 to 19",,,"Lar***Teg***r","https://www.manta.com/c/mmdzmm3/tegeler-chevrolet","https://www.manta.com/c/mmdzmm3/tegeler-chevrolet","mmdzmm3"
"End Over End Sound Productions","Texas","5735","210***438***","null","[""Shopping"",""Record and Prerecorded Tape Stores"",""Music Stores""]","San Antonio","United States","78250",,,,29.4898302,-98.6557997,"unknown",1994,,,"8630 Timberwilde Street null","Categorized under Musical Instruments. Our records show it was established in 1994 and incorporated in Texas. Current estimates show this company has an annual revenue of 66000 and employs a staff of approximately 1.",,,"66000","1",,,"Jes***Lop***","https://www.manta.com/c/mm75s87/end-over-end-sound-productions","https://www.manta.com/c/mm75s87/end-over-end-sound-productions","mm75s87"
"Airport Interiors","Tennessee","7389","615***202***","http://Airportinteriors.com","[""Business Services"",""Business Services, NEC"",""Interior Designer""]","Smyrna","United States","37167",,,,36.006261,-86.508077,"unknown",2004,,,"621 Fitzhugh Boulevard null","Categorized under Renovation of Aircraft Interiors. Our records show it was established in 2004 and incorporated in Tennessee. Current estimates show this company has an annual revenue of 279679 and employs a staff of approximately 4.",,,"279679","4",,,"Tom***rum***","https://www.manta.com/c/mml063y/airport-interiors","https://www.manta.com/c/mml063y/airport-interiors","mml063y"
"Pat Starr","Colorado","1741","303***378***","null","[""Construction"",""Masonry, Stone Setting, and Other Stone Work"",""Retaining Wall Construction""]","Highlands Ranch","United States","80129",,,,39.531027,-105.026504,"Single Location",1997,,,"3247 Oak Leaf Place","Categorized under Retaining Wall Construction. Our records show it was established in 1997 and incorporated in Colorado. Current estimates show this company has an annual revenue of 120231 and employs a staff of approximately 1.",,,"120231","1",,,"Pat***ar","https://www.manta.com/c/mmf10sq/pat-starr","https://www.manta.com/c/mmf10sq/pat-starr","mmf10sq"
"Patrick Tarrant Enterprises","New York","6512","212***346***","http://www.toppenthouse.com","[""Real Estate"",""Operators of Nonresidential Buildings"",""Property Operation, Retail Establishment""]","New York","United States","10003",,,,40.7370951,-73.9905662,"unknown",2004,,,"41 Union Square West # 610 null","Categorized under Building Contractors. Our records show it was established in 2004 and incorporated in New York. Current estimates show this company has an annual revenue of 280000 and employs a staff of approximately 3.",,,"280000","3",,,"Myr*** Ca***llo***","https://www.manta.com/c/mmnktt3/patrick-tarrant-enterprises","https://www.manta.com/c/mmnktt3/patrick-tarrant-enterprises","mmnktt3"
"Palmetto State Painting Pros","South Carolina","1721","803***434***","http://www.palmettostatepaintingpros.com","[""Construction"",""Painting and Paper Hanging"",""Painting and paper hanging""]","Gaston","United States","29053","{""friday"":false,""monday"":false,""saturday"":false,""sunday"":false,""wednesday"":false}","[null,null,null,null,null,null,null]","[null,null,null,null,null,null,null]",,,"unknown",,,,,"Palmetto State Painting Pros is dedicated to providing quality painting services to our customers with unparalleled attention to detail.
Palmetto State Painting Pros is a leading provider of residential painting services. With over 10 years of experience, our team of professionals offers superior service and quality craftsmanship tailored to each individual's budget and style. Our commitment to customer satisfaction is reflected in our dedication to delivering innovative and helpful solutions along with attention to detail.",,"{""facebook"":""https://www.facebook.com/palmettostatepaintingpros""}",,,,,,"https://www.manta.com/c/m1wxt9b/palmetto-state-painting-pros","https://www.manta.com/c/m1wxt9b/palmetto-state-painting-pros","m1wxt9b"
"Lund Financial Group","Massachusetts","6282","508***194***","http://www.lundfg.com","[""Financial"",""Investment Advice"",""Certified Financial Planners""]","Plainville","United States","02762",,,,42.0082197,-71.3070495,"unknown",2010,,,"30 Man Mar Drive null","Categorized under Investment Counselors. Our records show it was established in 2010 and incorporated in Massachusetts. Current estimates show this company has an annual revenue of 200269 and employs a staff of approximately 2.",,,"200269","2",,,"Chr***oph***Lun***","https://www.manta.com/c/mr0jx5z/lund-financial-group","https://www.manta.com/c/mr0jx5z/lund-financial-group","mr0jx5z"
"Bristol Capital Corporation","Massachusetts","6211","781***121***","null","[""Financial"",""Security Brokers, Dealers, and Flotation Companies"",""Investment Bankers""]","Weston","United States","02493",,,,42.3661906,-71.3037935,"Single Location",1988,,,"30 Colpitts Road 2","Categorized under Investment Bankers. Our records show it was established in 1988 and incorporated in Massachusetts. Current estimates show this company has an annual revenue of 550000 and employs a staff of approximately 5.",,,"550000","5",,,"Rob*** L ***s","https://www.manta.com/c/mm0m9g0/bristol-capital-corporation","https://www.manta.com/c/mm0m9g0/bristol-capital-corporation","mm0m9g0"
"A Family Limousine & Coaches","Florida","4111","954***745***","null","[""Car Rental"",""Local and Suburban Transit"",""Bus transportation""]","Dania Beach","United States","33004","{""friday"":false,""monday"":false,""saturday"":false,""sunday"":false,""wednesday"":false}","[null,null,null,null,null,null,null]","[null,null,null,null,null,null,null]",,,"unknown",,,,,"
In the searching that you're looking for transport, limo rental, party transport, or need to book private transportation anyplace all through South Florida — then you've come to the ideal locations! As one of the main limo and contract transport organizations in Florida, we have the region's most up-to-date vehicles, with a scope of transportation choices that incorporates cutting-edge party transport, and the best limo service Fort Lauderdale brings to the table. Our services in Fort Lauderdale, Miami, and Palm Beach promise luxury, comfort, and style for any travel need.",,,,,,,"Afa***y L***","https://www.manta.com/c/m1r6jvv/a-family-limousine-coaches","https://www.manta.com/c/m1r6jvv/a-family-limousine-coaches","m1r6jvv"
"Francisco Fuentes Cleaning LLC","Indiana","7699","******","null","[""Consumer Services"",""Repair Shops"",""Cleaning services""]","Indianapolis","United States","46234","{""friday"":false,""monday"":false,""saturday"":false,""sunday"":false,""wednesday"":false}","[null,null,null,null,null,null,null]","[null,null,null,null,null,null,null]",,,"Single Location",2010,,,,,,,"47000","1",,,,"https://www.manta.com/c/mtqc5xf/francisco-fuentes-cleaning-llc","https://www.manta.com/c/mtqc5xf/francisco-fuentes-cleaning-llc","mtqc5xf"
"Landscape Design By Lee","New York","5039","631***007***","http://www.landscapedesignbylee.com","[""Construction"",""Construction Materials, NEC"",""Construction Materials, Nec""]","Sayville","United States","11782",,,,40.7528873,-73.0744094,"unknown",,,,"308 Sayville Boulevard null","Categorized under Landscape Services. Current estimates show this company has an annual revenue of 71501 and employs a staff of approximately 2.",,,"71501","2",,,"Lee***lle***","https://www.manta.com/c/mtrvr9g/landscape-design-by-lee","https://www.manta.com/c/mtrvr9g/landscape-design-by-lee","mtrvr9g"
"Coinstar Kiosk | Bitcoin ATM","Arizona","6021","800***340***","https://www.coinstar.com/kiosk-info?KioskId=1734&","[""Financial"",""National Commercial Banks"",""Automated Teller Machines (ATMs)""]","Phoenix","United States","85023","{""friday"":false,""monday"":false,""saturday"":false,""sunday"":false,""wednesday"":false}","[""06:00AM"",""06:00AM"",""06:00AM"",""06:00AM"",""06:00AM"",""06:00AM"",""06:00AM""]","[""11:00PM"",""11:00PM"",""11:00PM"",""11:00PM"",""11:00PM"",""11:00PM"",""11:00PM""]",33.6380628,-112.1199773,"unknown",,"06:00AM","11:00PM","2727 West Bell Road","
Get started buying bitcoin within minutes from this Coinstar kiosk, powered by Coinme! In 2014, Coinme became the first state-licensed bitcoin ATM company in the United States and now operates the largest bitcoin kiosk network in the world.",,"{""facebook"":""https://www.facebook.com/100818222400096""}",,,,,,"https://www.manta.com/c/m1rqm7c/coinstar-kiosk-bitcoin-atm","https://www.manta.com/c/m1rqm7c/coinstar-kiosk-bitcoin-atm","m1rqm7c"
"Garman Electric","Indiana","1731","574***947***","http://www.garmanelectric.com","[""Electrical"",""Electrical Work"",""Electrical Contractors""]","Mishawaka","United States","46545",,,,41.6711459,-86.1897896,"unknown",1996,,,"1118 Forest Avenue null","Categorized under Electrical Designers. Our records show it was established in 1996 and incorporated in IN. Current estimates show this company has an annual revenue of 1934612 and employs a staff of approximately 18.",,,"1934612","18",,,"Tho*** Ga***n","https://www.manta.com/c/mm71t7w/garman-electric","https://www.manta.com/c/mm71t7w/garman-electric","mm71t7w"
"Anthony Mickeal Photography","New Jersey","7221","******","http://www.mickealphoto.com/","[""Consumer Services"",""Photographic Studios, Portrait"",""Wedding Photographers""]","Lodi","United States","07644","{""friday"":false,""monday"":false,""saturday"":false,""sunday"":true,""wednesday"":false}","[""CLOSED"",""9:00 AM"",""9:00 AM"",""9:00 AM"",""9:00 AM"",""9:00 AM"",""9:00 AM""]","[""CLOSED"",""5:00 PM"",""5:00 PM"",""5:00 PM"",""5:00 PM"",""5:00 PM"",""5:00 PM""]",40.8734946,-74.09592700000002,"unknown",,"9:00 AM","5:00 PM","174 Westminster pl",,"[""portrait photography services"",""digital photography services"",""Wedding photography"",""video photography services"",""studio photography""]",,,,,,"Ant***y M***eal***","https://www.manta.com/c/mh1cxjt/anthony-mickeal-photography","https://www.manta.com/c/mh1cxjt/anthony-mickeal-photography","mh1cxjt"
"Brady Design","New York","8712","631***311***","http://www.bbradydesign.com","[""Professional Services"",""Architectural Services"",""Architects""]","Southampton","United States","11968",,,,40.887613,-72.390124,"Single Location",2006,,,"129 Main Street","Categorized under Architects. Our records show it was established in 2006 and incorporated in New York. Current estimates show this company has an annual revenue of 255197 and employs a staff of approximately 2.",,,"255197","2",,,"Bri***Bra***","https://www.manta.com/c/mmssbnp/brady-design","https://www.manta.com/c/mmssbnp/brady-design","mmssbnp"
"Total Finishing Solutions, LLC","Oregon","5084","503***513***","http://www.totalfinishingsolutions.com","[""Industrial Machinery"",""Industrial Machinery and Equipment"",""Industrial machinery and equipment""]","Lake Oswego","United States","97034","{""friday"":false,""monday"":false,""saturday"":false,""sunday"":false,""wednesday"":false}","[null,null,null,null,null,null,null]","[null,null,null,null,null,null,null]",45.39847,-122.71524,"unknown",2011,,,"17501 Cardinal Drive","Finishing Systems, Spray Booths for Liquid Finishing and Powder Coating, IR and Convection Cure Ovens, Conveyors, Robotics and Paint Automation","[""spray booths"",""paint pumps"",""spray guns"",""ovens"",""conveyors"",""Spray Guns"",""Powder Coating Systems"",""Paint Pumps"",""Ovens"",""Conveyors"",""Spray Booths""]","{""facebook"":""https://www.facebook.com/TotalFinishingSolutions/""}",,"1",,,,"https://www.manta.com/c/mr5p601/total-finishing-solutions-llc","https://www.manta.com/c/mr5p601/total-finishing-solutions-llc","mr5p601"
"K & K Homes Group","Maryland","6531","(30***325***08","https://kandkhomesgroup.com/","[""Real Estate"",""Real Estate Agents and Managers"",""Real Estate Consultants""]","Gambrills","United States","21054","{""friday"":false,""monday"":false,""saturday"":false,""sunday"":false,""wednesday"":false}","[""12:00 AM"",""12:00 AM"",""12:00 AM"",""12:00 AM"",""12:00 AM"",""12:00 AM"",""12:00 AM""]","[""12:00 AM"",""12:00 AM"",""12:00 AM"",""12:00 AM"",""12:00 AM"",""12:00 AM"",""12:00 AM""]",39.06705,-76.66524,"unknown",,"12:00 AM","12:00 AM","1166 MD-3 Ste 106","
K & K Homes Group, led by Kelly Williams, is comprised of premier Gambrills, MD real estate agents for RE/MAX Leading Edge. The team serves the real estate needs of Mount Airy, Burtonsville, Ellicott City, Olney, Eldersburg, Silver Spring, and more. They pride themselves on providing personalized solutions that bring their clients closer to their dream properties and enhance their long-term wealth. Start your home-buying or selling journey with the K & K Homes Group today!","[""Mount Airy Real Estate"",""Burtonsville Real Estate"",""Ellicott City Real Estate"",""Olney Real Estate"",""Eldersburg Real Estate""]","{""facebook"":""https://www.facebook.com/KandKHomesGroup/""}",,"1",,,"Kel***Wil***ms","https://www.manta.com/c/m1wqmbq/k-k-homes-group","https://www.manta.com/c/m1wqmbq/k-k-homes-group","m1wqmbq"
"Intermountain Collision","Utah","7532","(80***568***36","http://www.intermountaincollisionwestjordan.com/","[""Automotive Services"",""Top, Body, and Upholstery Repair Shops and Paint Shops"",""Paint shop, automotive""]","West Jordan","United States","84088","{""friday"":false,""monday"":false,""saturday"":false,""sunday"":false,""wednesday"":false}","[null,null,null,null,null,null,null]","[null,null,null,null,null,null,null]",40.59738,-111.99145,"unknown",2007,,,"4362 W 8480 S","Bring your Car, Truck, SUV or Van to Intermountain Collision for quality dent repair, auto body repair, painting and refinishing.","[""automotive body shops"",""collision shops, automotive"",""auto services"",""Paint Repair"",""Dent Removal""]",,,"2 to 4",,,"Mar***olt***","https://www.manta.com/c/mm06147/intermountain-collision","https://www.manta.com/c/mm06147/intermountain-collision","mm06147"
