"company_name","business_state","sic_code","phone_number","website","business_categories","business_city","business_country","business_zip_code","closed_on","opening_hours","closing_hours","latitude","longitude","location_type","year_established","avg_opening_hour","avg_closing_hour","business_street_name","description","services","links","estimated_annual_revenue","num_employees","review_count","reviews","owner","manta_link","url","company_id"
"Beachside Boat Works","Florida","3732","(38***89-***7","null","[""Transportation Services"",""Boat Repair and Building"",""Boatbuilding and repairing""]","South Daytona","United States","32119","{""friday"":false,""monday"":false,""saturday"":false,""sunday"":false,""wednesday"":false}","[null,null,null,null,null,null,null]","[null,null,null,null,null,null,null]",,,"Single Location",2008,,,,"Mobile Marine Service Outboards Inboards Detailing Fishing Charters",,,"150000",,,,"Ale***der***ggo******","https://www.manta.com/c/mt17lgr/beachside-boat-works","https://www.manta.com/c/mt17lgr/beachside-boat-works","mt17lgr"
"Miller Residential Services","Oregon","1521","971***924***","null","[""Construction"",""General Contractors-Single-Family Houses"",""Home Improvements""]","Milwaukie","United States","97267",,,,45.414236,-122.652229,"Single Location",2014,,,"15055 Se Thornton Drive","Categorized under Home Improvements. Current estimates show this company has an annual revenue of 100025 and employs a staff of approximately 1.",,,"100025","1",,,"Pau***ill***","https://www.manta.com/c/mhk6fqp/miller-residential-services","https://www.manta.com/c/mhk6fqp/miller-residential-services","mhk6fqp"
"Ramirez Tile Laying, LLC","Oklahoma","1743","(91***277***92","null","[""Construction"",""Terrazzo, Tile, Marble, and Mosaic Work"",""Tile installation, ceramic""]","Tulsa","United States","74146","{""friday"":false,""monday"":false,""saturday"":false,""sunday"":false,""wednesday"":false}","[null,null,null,null,null,null,null]","[null,null,null,null,null,null,null]",36.11485,-95.83446,"NA",2007,,,"12702 E 33rd Place","Tile/Marble Contractor Tile and Terrazzo Contractors","[""tile flooring installation services""]",,,"2 to 4",,,"Hec*** Ra***ez","https://www.manta.com/c/mtq3h2f/ramirez-tile-laying-llc","https://www.manta.com/c/mtq3h2f/ramirez-tile-laying-llc","mtq3h2f"
"Highland Volkswagen","Indiana","7538","219***220***","null","[""Automotive Services"",""General Automotive Repair Shops"",""Car Repair and Services""]","Highland","United States","46322",,,,41.5393353,-87.4710544,"Single Location",2012,,,"9601 Indianapolis Boulevard","Categorized under Car Repair and Services. Current estimates show this company has an annual revenue of 157456 and employs a staff of approximately 3.",,,"157456","3",,,"Jos*** Ho***ar","https://www.manta.com/c/mhhnljj/highland-volkswagen","https://www.manta.com/c/mhhnljj/highland-volkswagen","mhhnljj"
"Nassau Moving LLC","Florida","4212","904***350***","http://www.nassau-moving.com","[""Car Rental"",""Local Trucking Without Storage"",""Moving Services""]","Fernandina Beach","United States","32034",,,,30.633347,-81.445568,"Single Location",2011,,,"2512 Caprice Lane","Categorized under Moving Services. Our records show it was established in 2011 and incorporated in FL. Current estimates show this company has an annual revenue of 145635 and employs a staff of approximately 2.",,,"145635","2",,,"Jan***Kre***","https://www.manta.com/c/mb4x2f9/nassau-moving-llc","https://www.manta.com/c/mb4x2f9/nassau-moving-llc","mb4x2f9"
"Divorce Lawyers for Men","Washington","8111","425***353***","http://www.divorcelawyersformen.com/king-county/bellevue/","[""Legal"",""Legal Services"",""Divorce and family law""]","Bellevue","United States","98004","{""friday"":false,""monday"":false,""saturday"":true,""sunday"":true,""wednesday"":false}","[""CLOSED"",""8:00 AM"",""8:00 AM"",""8:00 AM"",""8:00 AM"",""8:00 AM"",""CLOSED""]","[""CLOSED"",""5:00 PM"",""5:00 PM"",""5:00 PM"",""5:00 PM"",""5:00 PM"",""CLOSED""]",47.6178819,-122.19404099999997,"unknown",,"8:00 AM","5:00 PM","10900 NE 8th Street, Suite 1000",,,,,,,,"Div***e L***ers******","https://www.manta.com/c/mh183by/divorce-lawyers-for-men","https://www.manta.com/c/mh183by/divorce-lawyers-for-men","mh183by"
"Jamia S. Burns, Attorney at Law","Washington","8111","360***637***","null","[""Legal"",""Legal Services"",""General practice attorney, lawyer""]","Bellingham","United States","98225","{""friday"":false,""monday"":false,""saturday"":false,""sunday"":true,""wednesday"":false}","[""CLOSED"",""9:00 AM"",""9:00 AM"",""9:00 AM"",""9:00 AM"",""9:00 AM"",""9:00 AM""]","[""CLOSED"",""5:00 PM"",""5:00 PM"",""5:00 PM"",""5:00 PM"",""5:00 PM"",""5:00 PM""]",,,"Unknown",,"9:00 AM","5:00 PM",,"Burns Jamia","[""wills trusts and estates law attorneys""]",,,,,,"Jam***Bur***","https://www.manta.com/c/mbsmp6y/jamia-s-burns-attorney-at-law","https://www.manta.com/c/mbsmp6y/jamia-s-burns-attorney-at-law","mbsmp6y"
"Casey's Top Hat Chimney Sweeps","New Mexico","7349","(50***989***75","https://caseystophatchimneysweeps.com","[""Business Services"",""Cleaning Services"",""Chimney cleaning""]","Santa Fe","United States","87505","{""friday"":false,""monday"":false,""saturday"":true,""sunday"":true,""wednesday"":false}","[""CLOSED"",""9:00 AM"",""9:00 AM"",""9:00 AM"",""9:00 AM"",""9:00 AM"",""CLOSED""]","[""CLOSED"",""5:00 PM"",""5:00 PM"",""5:00 PM"",""5:00 PM"",""5:00 PM"",""CLOSED""]",35.6791108,-105.9374972,"unknown",,"9:00 AM","5:00 PM","7921 Old Santa Fe Trail","
44 years restoring thousands of Santa Fe's unique fireplaces taught us what to look for to insure the safety of your home. A stellar reputation in a small town. We're known for honest assessments and fair pricing earning the BBB highest rating. We were trusted to restore the fireplaces in Georgia O'Keefe's home, Paul Allen's residency, Forrest Fenn's Nedra Matteucci's home & gallery & the historic St Francis Hotel.",,,,,,,,"https://www.manta.com/c/mth7zk7/casey-s-top-hat-chimney-sweeps","https://www.manta.com/c/mth7zk7/casey-s-top-hat-chimney-sweeps","mth7zk7"
"Dejack Construction","Kentucky","1521","270***996***","null","[""Construction"",""General Contractors-Single-Family Houses"",""Home Builders""]","Island","United States","42350",,,,37.446464,-87.160277,"Single Location",2003,,,"5938 State Route 85 East","Categorized under Home Builders. Our records show it was established in 2003 and incorporated in Kentucky. Current estimates show this company has an annual revenue of 186571 and employs a staff of approximately 2.",,,"186571","2",,,"Jac*** Ho***d","https://www.manta.com/c/mmlv46h/dejack-construction","https://www.manta.com/c/mmlv46h/dejack-construction","mmlv46h"
"West Point Holdings LLC","Arkansas","6719","501***303***","null","[""Financial"",""Offices of Holding Companies, NEC"",""Non-Bank Holding Companies""]","North Little Rock","United States","72113",,,,34.8491,-92.4059,"Single Location",2005,,,"7 West Point Drive","Categorized under Non-Bank Holding Companies. Our records show it was established in 2005 and incorporated in Arkansas. Current estimates show this company has an annual revenue of 120000 and employs a staff of approximately 2.",,,"120000","2",,,"Mic***l R***se","https://www.manta.com/c/mm8zy17/west-point-holdings-llc","https://www.manta.com/c/mm8zy17/west-point-holdings-llc","mm8zy17"
"Shells North Tampa","Florida","5812","334***137***","null","[""Restaurants and Bars"",""Restaurants"",""Restaurants""]","Tampa","United States","33612",,,,28.05404,-82.4354315,"Single Location",2019,,,"2101 East Fowler Avenue","Categorized under Restaurants. Current estimates show this company has an annual revenue of 87243 and employs a staff of approximately 7.",,,"87243","7",,,,"https://www.manta.com/c/mkcc15d/shells-north-tampa","https://www.manta.com/c/mkcc15d/shells-north-tampa","mkcc15d"
"Westmoreland Pharmacy, Inc","Indiana","5912","812***002***","http://www.westmorelandpharmacy.com","[""Shopping"",""Drug Stores and Proprietary Stores"",""Pharmacies""]","Sellersburg","United States","47172",,,,38.370805,-85.757432,"Branch",,,,"7600 Highway 60 # 400","Categorized under Pharmacies. ",,,,,,,"Ant***y L***stm*********","https://www.manta.com/c/mkf5mc4/westmoreland-pharmacy-inc","https://www.manta.com/c/mkf5mc4/westmoreland-pharmacy-inc","mkf5mc4"
"gjhg","Ohio","7389","614***5-1***","null","[""Business Services"",""Business Services, NEC"",""Business services, nec""]","Columbus","United States","12345","{""friday"":false,""monday"":false,""saturday"":false,""sunday"":false,""wednesday"":false}","[null,null,null,null,null,null,null]","[null,null,null,null,null,null,null]",39.955796152353,-83.00238423049,"unknown",,,,"111,main",,,,,,,,"hry***hdh***","https://www.manta.com/c/mxjxvw5/gjhg","https://www.manta.com/c/mxjxvw5/gjhg","mxjxvw5"
"Darna Hookah Lounge","Florida","5812","(56***45-***3","http://www.darnalounge.com","[""Restaurants and Bars"",""Restaurants"",""Eating places""]","Boca Raton","United States","33432","{""friday"":false,""monday"":false,""saturday"":false,""sunday"":false,""wednesday"":false}","[""12:00 PM"",""12:00 PM"",""12:00 PM"",""12:00 PM"",""12:00 PM"",""12:00 PM"",""12:00 PM""]","[""4:00 AM"",""4:00 AM"",""4:00 AM"",""4:00 AM"",""4:00 AM"",""4:00 AM"",""4:00 AM""]",26.34962,-80.08365,"HQ",2013,"12:00 PM","4:00 AM","99 Southeast Mizner Boulevard",,"[""hookah"",""smoke shop"",""starbuz"",""alfakher"",""shawerma"",""falafel"",""karaoke"",""halal"",""tobacco flavoring cylinders"",""tobacco""]",,,,,,,"https://www.manta.com/c/mx4wcqh/darna-hookah-lounge","https://www.manta.com/c/mx4wcqh/darna-hookah-lounge","mx4wcqh"
"Longman & Van Grack's llc","Maryland","8231","301***1-5***","http://lvglawfirm.com/","[""Educational Services"",""Libraries"",""Law library""]","Bethesda","United States","20817","{""friday"":false,""monday"":false,""saturday"":true,""sunday"":true,""wednesday"":false}","[""CLOSED"",""9:00 AM"",""9:00 AM"",""9:00 AM"",""9:00 AM"",""9:00 AM"",""CLOSED""]","[""CLOSED"",""6:00 PM"",""6:00 PM"",""6:00 PM"",""6:00 PM"",""6:00 PM"",""CLOSED""]",39.0279726,-77.14284729999997,"unknown",,"9:00 AM","6:00 PM","10411Motor City Drive, Suite 750",,,,,,,,"van***ack***","https://www.manta.com/c/mh1lpm2/longman-van-grack-s-llc","https://www.manta.com/c/mh1lpm2/longman-van-grack-s-llc","mh1lpm2"
"Ever Ready Machine Inc","Minnesota","5571","******","null","[""Automotive Services"",""Motorcycle Dealers"",""ATV Parts and Accessories""]","Pine City","United States","55063",,,,45.8363,-92.9042,"Single Location",1995,,,"21634 Holly Road","Categorized under ATV Parts and Accessories. Our records show it was established in 1995 and incorporated in Minnesota. Current estimates show this company has an annual revenue of 240000 and employs a staff of approximately 2.",,,"240000","2",,,"Jef***oza***","https://www.manta.com/c/mm2r9hh/ever-ready-machine-inc","https://www.manta.com/c/mm2r9hh/ever-ready-machine-inc","mm2r9hh"
"Star Shuttle & Charter","Texas","4141","210***999***","http://starshuttle.com","[""Car Rental"",""Local Bus Charter Service"",""Local Bus Charter Services""]","San Antonio","United States","78209",,,,29.5159139,-98.4586941,"unknown",,,,"1100 NE Loop 410 # 610 null","Categorized under Business Services (Unclassified). Current estimates show this company has an annual revenue of unknown and employs a staff of approximately 1 to 4.",,,,"1 to 4",,,"Jam***Wal***","https://www.manta.com/c/mthl6xd/star-shuttle-charter","https://www.manta.com/c/mthl6xd/star-shuttle-charter","mthl6xd"
"Residential Locksmith in Washington Navy Yard, District Of Columbia DC","District of Columbia","7389","(20***660***21","http://washingtonnavyyard202locksmith.com/24-hour-locksmith-washington-navy-yard-district-of-columbia-dc/","[""Business Services"",""Business Services, NEC"",""Business services, nec""]","Washington Navy Yard","United States","32099","{""friday"":false,""monday"":false,""saturday"":false,""sunday"":false,""wednesday"":false}","[null,null,null,null,null,null,null]","[null,null,null,null,null,null,null]",38.8746334,-76.99454730000002,"unknown",,,,"23544 Cunningham Warren MI 48091","About Us Residential Locksmith in Washington Navy Yard, District Of Columbia DC
Washington Navy Yard Locksmith is owned by North America’s top locksmith company that services over 6000 cities across US & Canada and is known for its service commitment. We are your one-stop shop for all your security products and locksmith services you need.

Call Us: (202) 660-0421
Contact Us: http://washingtonnavyyard202locksmith.com/24-hour-locksmith-washington-navy-yard-district-of-columbia-dc/

Call us anytime day or night, we are going to be there at your service – that’s a promise.

Our Commitment

Our locksmith services are just a phone call away. Our commitment begins where it matters the most – at the local level. And because we’re backed by nationwide strength-with centers all over the country, you can count on us as a solutions provider for all your locksmith servicing needs.

Our Mode of Operation

At Washington Navy Yard Locksmith, we are 100% dedicated to serving the needs of our customers. We carry a wide range of security products and locksmith product line at the most competitive price. But we do it all by operating under our local company names, the names our customers know and trust-to make sure we stay focused on the right mix of customized products and services for that specific market.

Our Nationwide Network

We’re everywhere you need us to be.
We are one of the largest providers of locksmith services and security products in the US. We provide you with whatever locksmith services you need fast and efficiently. And we have a network of locksmiths located across the country where you’ll be treated with the same superior service and attention you’ve come to expect from your local Washington Navy Yard Locksmith.

Locksmith Services in Washington Navy Yard, District Of Columbia DC
Residential Locksmith in Washington Navy Yard, District Of Columbia DC
Emergency Locksmith in Washington Navy Yard, District Of Columbia DC
Automobile Locksmith in Washington Navy Yard, District Of Columbia DC
Industrial Locksmith in Washington Navy Yard, District Of Columbia DC
Commercial Locksmith in Washington Navy Yard, District Of Columbia DC
24 Hour Locksmith in Washington Navy Yard, District Of Columbia DC
Automotive Locksmith in Washington Navy Yard, District Of Columbia DC",,,,,,,"lum***ad ***pko***","https://www.manta.com/c/mx4y27h/residential-locksmith-in-washington-navy-yard-district-of-columbia-dc","https://www.manta.com/c/mx4y27h/residential-locksmith-in-washington-navy-yard-district-of-columbia-dc","mx4y27h"
"Adam Buys Houses - We Buy Houses Denver","Colorado","6531","(30***558***43","http://www.adambuysdenverco.com/","[""Real Estate"",""Real Estate Agents and Managers"",""Real estate agents and managers""]","Denver","United States","80203","{""friday"":false,""monday"":false,""saturday"":false,""sunday"":false,""wednesday"":false}","[null,null,null,null,null,null,null]","[null,null,null,null,null,null,null]",39.7409458,-104.9724971,"unknown",,,,"1541 North Marion Street #300484",,,,,,,,"Ada***aci***","https://www.manta.com/c/mh1gqjy/adam-buys-houses-we-buy-houses-denver","https://www.manta.com/c/mh1gqjy/adam-buys-houses-we-buy-houses-denver","mh1gqjy"
"Advantage Cleaning Service","Alaska","7349","(90***248***11","http://advantagecleaningalaska.com","[""Business Services"",""Cleaning Services"",""Building maintenance services, nec""]","Anchorage","United States","99517","{""friday"":false,""monday"":false,""saturday"":true,""sunday"":true,""wednesday"":false}","[""CLOSED"",""10:00 AM"",""10:00 AM"",""10:00 AM"",""10:00 AM"",""10:00 AM"",""CLOSED""]","[""CLOSED"",""4:00 PM"",""4:00 PM"",""4:00 PM"",""4:00 PM"",""4:00 PM"",""CLOSED""]",61.17708,-149.91708,"unknown",2005,"10:00 AM","4:00 PM","1801 W 48th Avenue # 203","Advantage Cleaning Services is a Green Cleaning Company that has been serving Anchorage since 2005. View our website at advantagecleaningalaska.com
Commercial, Residential, Interior, Exterior, Move In, Move Out, Post Construction Clean Up, Window Washing, Chandelier Cleaning, Carpet Cleaning, House Keeping, Janitorial, Spring Cleaning, Event Cleaning and Services, Landscaping, Lighting Maintenance, Pressure Washing, Gutter Cleaning, Motor Vehicle Detailing, Minor Plumbing Carpentry and Electrical Work, Recycling Services, Green Product Sales, Energy Efficiency Consult, 24 Hour Porter Service, Licensed, Bonded, Insured, Free Estimates

(907) 248-3111

advantagecleaningalaska.com","[""cleaning services""]",,,"2 to 4",,,"Jac***Ols***","https://www.manta.com/c/mmbq5w9/advantage-cleaning-service","https://www.manta.com/c/mmbq5w9/advantage-cleaning-service","mmbq5w9"
"Marchand Electrical","Louisiana","1731","225***478***","null","[""Electrical"",""Electrical Work"",""Electrical Contractors""]","Donaldsonville","United States","70346",,,,30.1012481565516,-90.9836105062867,"unknown",2008,,,"809 Webster Street null","Categorized under Electrical Contractors. Our records show it was established in 2008 and incorporated in Louisiana. Current estimates show this company has an annual revenue of 165389 and employs a staff of approximately 2.",,,"165389","2",,,"Pau***arc***d","https://www.manta.com/c/mttwy6d/marchand-electrical","https://www.manta.com/c/mttwy6d/marchand-electrical","mttwy6d"
"Clay County Head Start","Indiana","8351","812***110***","http://www.forfitterfeet.com","[""Consumer Services"",""Child Day Care Services"",""Child Day Care Services, Nec""]","Brazil","United States","47834",,,,39.519973,-87.136691,"unknown",,,,"800 West Jackson Street null","Categorized under Head Start Center, Except in Conjunction With School. ",,,,,,,"Jea***ood***","https://www.manta.com/c/mmg019t/clay-county-head-start","https://www.manta.com/c/mmg019t/clay-county-head-start","mmg019t"
"Twizt'd Lynz Tattoo Studio","Indiana","7299","(26***388***56","https://twiztdlynztattoostudio.com/","[""Consumer Services"",""Miscellaneous Personal Services, NEC"",""Tattoo parlor""]","Huntington","United States","46750","{""friday"":true,""monday"":true,""saturday"":true,""sunday"":true,""thursday"":""true"",""tuesday"":""true"",""wednesday"":true}","[""CLOSED"",""CLOSED"",""CLOSED"",""CLOSED"",""CLOSED"",""CLOSED"",""CLOSED""]","[""CLOSED"",""CLOSED"",""CLOSED"",""CLOSED"",""CLOSED"",""CLOSED"",""CLOSED""]",40.8929174,-85.5056164,"unknown",2021,,,"2086 N Jefferson St","
We’re TWIZT’d LYNZ Tattoo Studio, and we are a full service tattoo and piercing studio here in Huntington, IN, since 2021. We're a group of friends and colleagues, who love and appreciate body art. With more than 30 years of combined experience in the industry, we take pride in our work and we love serving our great community. We’re looking forward to partnering with our community and the surrounding communities to continue to offer a premier tattoo and piercing experience. We’d like to personally invite you to book your appointment with any one of our four artists today! We're available by appointment only.","[""Tattoos"",""Piercings"",""Body Piercings"",""Ear Piercings"",""Tattoo Cover-Ups"",""Tattoos"",""Jewelry"",""Local Art"",""Tattoo Numbing Cream""]","{""facebook"":""http://www.facebook.com/TWIZTdLYNZTattoo/""}",,,,,"******","https://www.manta.com/c/m196sly/twizt-d-lynz-tattoo-studio","https://www.manta.com/c/m196sly/twizt-d-lynz-tattoo-studio","m196sly"
"Analogy","Arizona","7379","480***948***","http://analogystudios.com","[""IT Outsourcing"",""Computer Related Services, NEC"",""Online Services Technology Consultants""]","Mesa","United States","85205",,,,33.4307551,-111.7466759,"unknown",2016,,,"3928 East Ellis Street null","Categorized under Internet Connectivity Services. Current estimates show this company has an annual revenue of 67596 and employs a staff of approximately 2.",,,"67596","2",,,"Mic***Ada***ast***","https://www.manta.com/c/mhspxj0/analogy","https://www.manta.com/c/mhspxj0/analogy","mhspxj0"
"Franko Concrete Pumping","Florida","1521","305***819***","http://www.frakoconcreteservices.com","[""Construction"",""General Contractors-Single-Family Houses"",""General Contractors""]","Miami","United States","33174",,,,25.7656385,-80.3632472,"unknown",1988,,,"10312 SW 3rd Street null","Categorized under Building Materials Transport. Our records show it was established in 1988 and incorporated in Florida. Current estimates show this company has an annual revenue of 411488 and employs a staff of approximately 5.",,,"411488","5",,,"Fra***sco***rci***","https://www.manta.com/c/mm4llf3/franko-concrete-pumping","https://www.manta.com/c/mm4llf3/franko-concrete-pumping","mm4llf3"
"Vimana Investment Group LLC","Virginia","6799","703***818***","null","[""Financial"",""Investors, NEC"",""Investors (Unclassified)""]","Alexandria","United States","22304",,,,38.8122801,-77.1210135,"Single Location",2019,,,"5145 Duke Street # D","Categorized under Investors (Unclassified). Our records show it was established in 2019 and incorporated in VA. Current estimates show this company has an annual revenue of 80125 and employs a staff of approximately 2.",,,"80125","2",,,,"https://www.manta.com/c/mkbckfx/vimana-investment-group-llc","https://www.manta.com/c/mkbckfx/vimana-investment-group-llc","mkbckfx"
"Hardys Sausage LLC","Louisiana","5421","337***666***","null","[""Shopping"",""Seafood Markets"",""Meat and Fish Markets""]","Iowa","United States","70647",,,,30.236108,-92.998461,"Single Location",2010,,,"100 Harper Street","Categorized under Meat and Fish Markets. Our records show it was established in 2010 and incorporated in Louisiana. Current estimates show this company has an annual revenue of 160000 and employs a staff of approximately 3.",,,"160000","3",,,"Lor***ne ***ard***","https://www.manta.com/c/mby1v6l/hardys-sausage-llc","https://www.manta.com/c/mby1v6l/hardys-sausage-llc","mby1v6l"
"The Equinox Group","Massachusetts","6531","(61***631***80","https://equinoxgroupre.com/","[""Real Estate"",""Real Estate Agents and Managers"",""Real estate agent, residential""]","Newton","United States","02459","{""friday"":false,""monday"":false,""saturday"":false,""sunday"":false,""wednesday"":false}","[""12:00 AM"",""12:00 AM"",""12:00 AM"",""12:00 AM"",""12:00 AM"",""12:00 AM"",""12:00 AM""]","[""12:00 AM"",""12:00 AM"",""12:00 AM"",""12:00 AM"",""12:00 AM"",""12:00 AM"",""12:00 AM""]",42.3251935,-71.1993721,"unknown",,"12:00 AM","12:00 AM","1261 Centre St","
The Equinox Group, led by Paul Reeves, is comprised of premier Newton, MA real estate agents for Coldwell Banker Realty. The team serves the real estate needs of Boston, Brookline, Wellesley, Natick, Needham, and surrounding areas. They have a talent for identifying and analyzing investment opportunities and trends for any real estate investment strategy and have successfully helped many clients build and expand—or liquidate—their portfolios. Start working with The Equinox Group today!","[""Newton Real Estate"",""Boston Real Estate"",""Brookline Real Estate"",""Wellesley Real Estate"",""Natick Real Estate""]","{""facebook"":""https://www.facebook.com/equinoxgroupre?_rdc=1&_rdr#""}",,"2 to 4",,,"Pau***eev***","https://www.manta.com/c/m1x9txj/the-equinox-group","https://www.manta.com/c/m1x9txj/the-equinox-group","m1x9txj"
"BarterDown","California","5963","******","http://www.barterdown.com","[""Consumer Services"",""Direct Selling Establishments"",""Direct selling establishments""]","San Luis Obispo","United States","93444","{""friday"":false,""monday"":false,""saturday"":false,""sunday"":false,""wednesday"":false}","[null,null,null,null,null,null,null]","[null,null,null,null,null,null,null]",35.036123245954,-120.4870142787,"unknown",2011,,,"110 Mary","Shop BarterDown. Buyers Save Money bartering the price down. Sellers Make Money selling items online. Signup today for a booth and start selling stuff","[""sell products"",""sell items"",""shop and buy"",""purchasing service"",""make money""]",,,"2 to 4",,,"Sho***art***own***","https://www.manta.com/c/mx7rsbv/barterdown","https://www.manta.com/c/mx7rsbv/barterdown","mx7rsbv"
"Hanalei River Ranch LLC","Hawaii","0291","808***158***","null","[""Agriculture"",""General Farms, Primarily Livestock and Animal Specialties"",""Ranches""]","Hanalei","United States","96714",,,,22.1603,-159.5471,"Single Location",2009,,,"5225 Hanalei Plantation R","Categorized under Ranches. Our records show it was established in 2009 and incorporated in Hawaii. Current estimates show this company has an annual revenue of 79000 and employs a staff of approximately 2.",,,"79000","2",,,,"https://www.manta.com/c/mtbp585/hanalei-river-ranch-llc","https://www.manta.com/c/mtbp585/hanalei-river-ranch-llc","mtbp585"
"Clean Energy Trust","Illinois","8399","847***222***","https://evergreeninno.org/contact-us","[""Public Sector"",""Social Services, NEC"",""Non-Profit Organizations""]","Chicago","United States","60606",,,,41.8817298,-87.6364464,"unknown",,,,"1 South Wacker Drive # 1900 null","Categorized under Energy Management Systems and Products. Current estimates show this company has an annual revenue of $1 to 2.5 million and employs a staff of approximately 5 to 9.",,,,"5 to 9",,,"Amy***anc***c","https://www.manta.com/c/mb800vh/clean-energy-trust","https://www.manta.com/c/mb800vh/clean-energy-trust","mb800vh"
